title,author,upvotes,permalink
"[TV show] Two frienemies who occasionally scream in pain but never speak",dangergypsy,458,https://reddit.com/r/ExplainAFilmPlotBadly/comments/in2v47/tv_show_two_frienemies_who_occasionally_scream_in/
"The adventures of a burn victim and his two children",dangergypsy,459,https://reddit.com/r/ExplainAFilmPlotBadly/comments/iijj1y/the_adventures_of_a_burn_victim_and_his_two/
"Black guy shoots up club full of very white guys",[deleted],460,https://reddit.com/r/ExplainAFilmPlotBadly/comments/e9o0fd/black_guy_shoots_up_club_full_of_very_white_guys/
"A senior citizen amateur aviator learns not to meet your heroes.",Jaleou,459,https://reddit.com/r/ExplainAFilmPlotBadly/comments/i2dhnv/a_senior_citizen_amateur_aviator_learns_not_to/
"Three severely handicapped individuals each lacking a vital organ, are able to pool their resources to help a tourist find her way home.",pocketdare,456,https://reddit.com/r/ExplainAFilmPlotBadly/comments/98d6jv/three_severely_handicapped_individuals_each/
"Old man with midlife crisis gets high with a boy-scout and a talking dog.",[deleted],453,https://reddit.com/r/ExplainAFilmPlotBadly/comments/9elz3n/old_man_with_midlife_crisis_gets_high_with_a/
"A police woman unveils a racist conspiracy.",Supergecki,451,https://reddit.com/r/ExplainAFilmPlotBadly/comments/jx4lkv/a_police_woman_unveils_a_racist_conspiracy/
"Hockey player moves to San Francisco, and can’t make any friends. Then rides a wagon out of a black hole.",rmath12,456,https://reddit.com/r/ExplainAFilmPlotBadly/comments/hthjh8/hockey_player_moves_to_san_francisco_and_cant/
"Purple monster man fucks shit up, stopped by muscle guy green boi and friends",[deleted],451,https://reddit.com/r/ExplainAFilmPlotBadly/comments/echzww/purple_monster_man_fucks_shit_up_stopped_by/
"In the mood for a movie about a guy named Mickey? THIS is the movie for you. It's all about Mickey. There are also others a lot like Mickey, but not quite Mickey. You want numbers to be a HUGE part of the plot. Boom. Oh, a specific odd number? You got it. You want the number in the title?? FINE.",TomahawkA5,457,https://reddit.com/r/ExplainAFilmPlotBadly/comments/1ky12hi/in_the_mood_for_a_movie_about_a_guy_named_mickey/
"Entertainer puts on a hell of a show, review gets a thumbs down, so he kills the critic",TheNerdyAnarchist,449,https://reddit.com/r/ExplainAFilmPlotBadly/comments/eotsog/entertainer_puts_on_a_hell_of_a_show_review_gets/
"Petty criminal is caught vandalizing, and has to work for the business as restitution. While there, he hatches a plan to steal valuable property from the company and throw it into the ocean.",orneryweevil,451,https://reddit.com/r/ExplainAFilmPlotBadly/comments/ic6be5/petty_criminal_is_caught_vandalizing_and_has_to/
"Kid who is sick of getting his ass kicked gets magic powers and somehow gets ass kicked more.",rululuku,449,https://reddit.com/r/ExplainAFilmPlotBadly/comments/i62gxr/kid_who_is_sick_of_getting_his_ass_kicked_gets/
"Scientist turns himself into a pickle looking monster",zoink26,445,https://reddit.com/r/ExplainAFilmPlotBadly/comments/fcpman/scientist_turns_himself_into_a_pickle_looking/
"Two boys fight then a girl helps them beat up a monster",Yeet69Yeet420Yeet,447,https://reddit.com/r/ExplainAFilmPlotBadly/comments/eufiu3/two_boys_fight_then_a_girl_helps_them_beat_up_a/
"Young people in the 2040s have encyclopedic knowledge of 80s comedies and think birthmarks are horrible",hotdogfallguy,447,https://reddit.com/r/ExplainAFilmPlotBadly/comments/j6f18v/young_people_in_the_2040s_have_encyclopedic/
"it takes their artsy friend to commit suicide for them to standup for what they believe in",shaburushaburu,448,https://reddit.com/r/ExplainAFilmPlotBadly/comments/jf8to7/it_takes_their_artsy_friend_to_commit_suicide_for/
"Guy wins poker game, then as a direct result of this win he gets laid then dies.",NoraGrooGroo,445,https://reddit.com/r/ExplainAFilmPlotBadly/comments/f1gdka/guy_wins_poker_game_then_as_a_direct_result_of/
"Two brothers are tracked by their dad who is sent to kill them by the man they are trying to kill.",attaraxicpsycho,447,https://reddit.com/r/ExplainAFilmPlotBadly/comments/drgiud/two_brothers_are_tracked_by_their_dad_who_is_sent/
"A fantasy film that I suspect is popular among flat earthers",[deleted],440,https://reddit.com/r/ExplainAFilmPlotBadly/comments/iemny4/a_fantasy_film_that_i_suspect_is_popular_among/
"Young teenager makes deal with old woman who has vendetta against girls father for the ability to walk",[deleted],446,https://reddit.com/r/ExplainAFilmPlotBadly/comments/etqsza/young_teenager_makes_deal_with_old_woman_who_has/
"Guy tries to set up his dad with his mom",Batdog55110,450,https://reddit.com/r/ExplainAFilmPlotBadly/comments/eaoli4/guy_tries_to_set_up_his_dad_with_his_mom/
"Old man pulls some strings to avoid being evicted, but things head south",kmr222,444,https://reddit.com/r/ExplainAFilmPlotBadly/comments/buagny/old_man_pulls_some_strings_to_avoid_being_evicted/
"guy loses brother, so he decides to fight a dude with a mask, using a balloon with jet thrusters.",solid_salad,442,https://reddit.com/r/ExplainAFilmPlotBadly/comments/eay6as/guy_loses_brother_so_he_decides_to_fight_a_dude/
"A precocious eight-year-old boy has his nice home (with a scary basement) invaded by a team of criminals. Elsewhere, other homes are flooded.",nmk537,439,https://reddit.com/r/ExplainAFilmPlotBadly/comments/1hheyb0/a_precocious_eightyearold_boy_has_his_nice_home/
"A wounded veteran tries to get a ton of cats off of a tree.",[deleted],439,https://reddit.com/r/ExplainAFilmPlotBadly/comments/k8uilf/a_wounded_veteran_tries_to_get_a_ton_of_cats_off/
"A woman travels the world to reconnect with her old coworkers after a four year hiatus",STuitt,444,https://reddit.com/r/ExplainAFilmPlotBadly/comments/jhm5bc/a_woman_travels_the_world_to_reconnect_with_her/
"An underprivledge Black Kid has to fight to change the rules of an ethnostate",[deleted],441,https://reddit.com/r/ExplainAFilmPlotBadly/comments/fn1z0a/an_underprivledge_black_kid_has_to_fight_to/
"Man lives in new york. He uses the radio often. He never comes out at night. His dog dies. He meets people from a different state and cure a disease",Iamprettyterrible,441,https://reddit.com/r/ExplainAFilmPlotBadly/comments/ds8sqf/man_lives_in_new_york_he_uses_the_radio_often_he/
"Bartender gives out free wings",KFY,439,https://reddit.com/r/ExplainAFilmPlotBadly/comments/do40aj/bartender_gives_out_free_wings/
"A man sleeps on a long plane journey. Several others do too.",budgie93,442,https://reddit.com/r/ExplainAFilmPlotBadly/comments/hhch5q/a_man_sleeps_on_a_long_plane_journey_several/
"8-year-old boy attempts double homicide multiple times in course of one evening",diu_tu_bo,440,https://reddit.com/r/ExplainAFilmPlotBadly/comments/bh86yt/8yearold_boy_attempts_double_homicide_multiple/
"The best swimmer in the world, one man who cant swim, the fastest carver alive and some other dudes are saving the country while Jean-Luc Picard is busy. And Dave Chapelle is somehow in the movie too.",Mnieme,439,https://reddit.com/r/ExplainAFilmPlotBadly/comments/k05ti3/the_best_swimmer_in_the_world_one_man_who_cant/
"A traumatized vet with a drinking problem teams with a barely together drug addict, a former missionary, and a medical practitioner to save a bunch of people in trouble.",timeshaper,441,https://reddit.com/r/ExplainAFilmPlotBadly/comments/jrn83n/a_traumatized_vet_with_a_drinking_problem_teams/
"Two ex convicts try to rob and murder a neglected child",ConsciousLog4,434,https://reddit.com/r/ExplainAFilmPlotBadly/comments/i8sjl6/two_ex_convicts_try_to_rob_and_murder_a_neglected/
"A man is obsessed with his mother and making a special dress",wimmick,439,https://reddit.com/r/ExplainAFilmPlotBadly/comments/jnuhaa/a_man_is_obsessed_with_his_mother_and_making_a/
"Rock steals rock",Death_Muffins,436,https://reddit.com/r/ExplainAFilmPlotBadly/comments/jczcyi/rock_steals_rock/
"A man seduces a mentally challenged woman and proceeds to manipulate her to live on a boat with him for the rest of her natural born life using his filmmaking abilities.",RhubarbAdditional657,432,https://reddit.com/r/ExplainAFilmPlotBadly/comments/1kp0b0r/a_man_seduces_a_mentally_challenged_woman_and/
"I’m Blue, and I’m smart dabada, dabadeedabada",Blaize-TheRevolution,433,https://reddit.com/r/ExplainAFilmPlotBadly/comments/iana0o/im_blue_and_im_smart_dabada_dabadeedabada/
"A child gets rebuffed by their favorite celebrity, so they spend the next 20 years hunting down and murdering the celebrities’ friends ",[deleted],433,https://reddit.com/r/ExplainAFilmPlotBadly/comments/1hscfwc/a_child_gets_rebuffed_by_their_favorite_celebrity/
"(Series) Guy wakes up from a really long nap, and immediately resumes his dead-end career.",ShadowOps84,430,https://reddit.com/r/ExplainAFilmPlotBadly/comments/kuqmql/series_guy_wakes_up_from_a_really_long_nap_and/
"Man angers family because he wouldn’t put down the chocolate and awakens the beast.",nickelboot,429,https://reddit.com/r/ExplainAFilmPlotBadly/comments/fiipjl/man_angers_family_because_he_wouldnt_put_down_the/
"Boy has existencial crisis while struggling with issues of morality. In the end, his conscience guides him to a happy conclusion.",dareyoutomove,434,https://reddit.com/r/ExplainAFilmPlotBadly/comments/e5a1wr/boy_has_existencial_crisis_while_struggling_with/
"A rope broke; we cried.",robito99,434,https://reddit.com/r/ExplainAFilmPlotBadly/comments/itly9m/a_rope_broke_we_cried/
"Guy finds out everyone is gullible and takes advantage of it",lp437,429,https://reddit.com/r/ExplainAFilmPlotBadly/comments/i487m1/guy_finds_out_everyone_is_gullible_and_takes/
"A guy teaches a girl how to sleep and together they sleep with his wife.",tamago_yaki218,431,https://reddit.com/r/ExplainAFilmPlotBadly/comments/hdhhym/a_guy_teaches_a_girl_how_to_sleep_and_together/
"A mouse stops someone from turning people into animals",Mage_ora,430,https://reddit.com/r/ExplainAFilmPlotBadly/comments/gu331a/a_mouse_stops_someone_from_turning_people_into/
"PETA starts the apocalypse",[deleted],430,https://reddit.com/r/ExplainAFilmPlotBadly/comments/fewtei/peta_starts_the_apocalypse/
"Woman sees therapist about work issues",DavianExpressed,429,https://reddit.com/r/ExplainAFilmPlotBadly/comments/js8jxl/woman_sees_therapist_about_work_issues/
"Some guys are stuck inside during a snow day. They’re bummed their friends couldn’t come over, so they play with a dog.",King_of_Actor,422,https://reddit.com/r/ExplainAFilmPlotBadly/comments/huam7g/some_guys_are_stuck_inside_during_a_snow_day/
"A funny guy with a goatee tries to get gems back from a big guy who wants their power",[deleted],426,https://reddit.com/r/ExplainAFilmPlotBadly/comments/emg1lf/a_funny_guy_with_a_goatee_tries_to_get_gems_back/
"The guy from taken takes a child",made_it_for_lwiay,429,https://reddit.com/r/ExplainAFilmPlotBadly/comments/ioy78y/the_guy_from_taken_takes_a_child/
"This movie could've been a lot shorter if the main character had a notepad.",MissBarker93,425,https://reddit.com/r/ExplainAFilmPlotBadly/comments/g3x5cy/this_movie_couldve_been_a_lot_shorter_if_the_main/
"Lonesome teen gets drugged by a cop, put in a cage, and taken across the country, to avoid getting skinned alive by a psychopath with facial styling from the 1860's.",Ashlesdire,423,https://reddit.com/r/ExplainAFilmPlotBadly/comments/fpb83g/lonesome_teen_gets_drugged_by_a_cop_put_in_a_cage/
"Guy gets mind raped whilst his friends just stand there watching him",TheFantasticXman1,422,https://reddit.com/r/ExplainAFilmPlotBadly/comments/esehwz/guy_gets_mind_raped_whilst_his_friends_just_stand/
"Girl takes her sisters spot in a teenage talent show",_Xelm,431,https://reddit.com/r/ExplainAFilmPlotBadly/comments/9jy9ps/girl_takes_her_sisters_spot_in_a_teenage_talent/
"A hitman dressed in black kills everyone in his way to accomplish his mission. Not even Thanos could stop him.",TheRavenousSnakeClaw,425,https://reddit.com/r/ExplainAFilmPlotBadly/comments/jze7y7/a_hitman_dressed_in_black_kills_everyone_in_his/
"Old man's story causes troubled young man to commit genocide.",TheHobo910,428,https://reddit.com/r/ExplainAFilmPlotBadly/comments/hn2fai/old_mans_story_causes_troubled_young_man_to/
"Rich guy finds out he has a son. Who is also the grandson of one of his worst enemies.",TheFantasticXman1,420,https://reddit.com/r/ExplainAFilmPlotBadly/comments/f7rw54/rich_guy_finds_out_he_has_a_son_who_is_also_the/
"Two hour ad for milk w/Natalie Portman",Aiphos16,423,https://reddit.com/r/ExplainAFilmPlotBadly/comments/eilrkw/two_hour_ad_for_milk_wnatalie_portman/
"This poorly timed film has nothing to do with 9/11, while having direct ties to 9/11.",KaiNooks,426,https://reddit.com/r/ExplainAFilmPlotBadly/comments/1k6xnqz/this_poorly_timed_film_has_nothing_to_do_with_911/
"They go back in time to stop a monster, but that creates a worse monster, so they have to bring back the first monster to stop the worse one, but now the first one is worse, so they have to bring the other one back to stop the first one again",Omboreas,420,https://reddit.com/r/ExplainAFilmPlotBadly/comments/it5bnl/they_go_back_in_time_to_stop_a_monster_but_that/
"[TV Show] Antisocial young man brought up in a violent cult abducts a small child, killing dozens of people in the process",bealtimint,417,https://reddit.com/r/ExplainAFilmPlotBadly/comments/jtzw8m/tv_show_antisocial_young_man_brought_up_in_a/
"Perfectly pleasant society turns to chaos by the introduction of a female.",[deleted],420,https://reddit.com/r/ExplainAFilmPlotBadly/comments/e3tt7a/perfectly_pleasant_society_turns_to_chaos_by_the/
"2 disabled friends go to hell for some electricity.",Boom_BoxKid,422,https://reddit.com/r/ExplainAFilmPlotBadly/comments/hpw6b5/2_disabled_friends_go_to_hell_for_some_electricity/
"I forgot a lot of stuff as a child but it turns out diaries are useful and now I control the existence of reality",NinjaNoob31907,427,https://reddit.com/r/ExplainAFilmPlotBadly/comments/iqs4ni/i_forgot_a_lot_of_stuff_as_a_child_but_it_turns/
"A family seems oblivious to their relatives’ spontaneous mobility due to the fortune of another family member, despite feigning disability to avoid contributing to the household.",[deleted],416,https://reddit.com/r/ExplainAFilmPlotBadly/comments/hr1bmg/a_family_seems_oblivious_to_their_relatives/
"A household machine eventually becomes a very realistic sex doll over the years",[deleted],422,https://reddit.com/r/ExplainAFilmPlotBadly/comments/g31x0u/a_household_machine_eventually_becomes_a_very/
"If you want a job kidnap someone who excels at it.",Andy-Banner,421,https://reddit.com/r/ExplainAFilmPlotBadly/comments/j0nhj9/if_you_want_a_job_kidnap_someone_who_excels_at_it/
"Man turns into woman, turns into another man, turns back into himself, then turns into a kid, turns into himself and dies",426strings,418,https://reddit.com/r/ExplainAFilmPlotBadly/comments/hf2r7f/man_turns_into_woman_turns_into_another_man_turns/
"guy tries to win a girl over for the rest for their lives, if she only knew who he was",KateHanami,420,https://reddit.com/r/ExplainAFilmPlotBadly/comments/gwez06/guy_tries_to_win_a_girl_over_for_the_rest_for/
"A loser joins forces with a twitch streamer, a mechanic and two ninjas who use his obsession with a dead guy to help him win ownership of another world.",GenericName232,416,https://reddit.com/r/ExplainAFilmPlotBadly/comments/dnb0xo/a_loser_joins_forces_with_a_twitch_streamer_a/
"A Demigod dies, they won’t fly, but in the end, the goal is fried.",StarsOfGaming,419,https://reddit.com/r/ExplainAFilmPlotBadly/comments/jox2m0/a_demigod_dies_they_wont_fly_but_in_the_end_the/
"Soft giant sidekick of evil mastermind triggers a chain reaction that stops the architectural expansion the local community",pandadutchess,421,https://reddit.com/r/ExplainAFilmPlotBadly/comments/ixlzvb/soft_giant_sidekick_of_evil_mastermind_triggers_a/
"A guy who has died and come back to life teams up with a guy he killed who was brought back to life to help him get revenge on another guy who’s daughter is the first guy’s ex",[deleted],415,https://reddit.com/r/ExplainAFilmPlotBadly/comments/gcm5tb/a_guy_who_has_died_and_come_back_to_life_teams_up/
"A group of adults bully a small alien to death",DJ_Lipko,416,https://reddit.com/r/ExplainAFilmPlotBadly/comments/fw5qgh/a_group_of_adults_bully_a_small_alien_to_death/
"Guy isn’t like these other guys because he’s not wearing hockey pads.",[deleted],417,https://reddit.com/r/ExplainAFilmPlotBadly/comments/fgzt9z/guy_isnt_like_these_other_guys_because_hes_not/
"Five slaves, one particularly courageous, are abandoned by their slave-driver. They go on an adventure to reunite with him.",the_great_zyzogg,414,https://reddit.com/r/ExplainAFilmPlotBadly/comments/epl4d1/five_slaves_one_particularly_courageous_are/
"A son and father are caught in a riot where the father is tragically murdered. The son runs away to live with a gay couple, years later he returns home to kill his metrosexual uncle.",Harshmike-,414,https://reddit.com/r/ExplainAFilmPlotBadly/comments/9f0zdp/a_son_and_father_are_caught_in_a_riot_where_the/
"The Hulk, Lex Luthor, Carson Wells, Lloyd Montgomery Garmadon and Agent Lacey defeats Harry Potter and Alfred Pennyworth in a Magic Show with the help from God",ThomasHarrison618,413,https://reddit.com/r/ExplainAFilmPlotBadly/comments/ecrn21/the_hulk_lex_luthor_carson_wells_lloyd_montgomery/
"Germans, Japanese, and Americans all come together to celebrate Christmas.",MightGetFiredIDK,416,https://reddit.com/r/ExplainAFilmPlotBadly/comments/jh7kpo/germans_japanese_and_americans_all_come_together/
"After world destroying virus breaks out two species go to war over a dam",springfox64,419,https://reddit.com/r/ExplainAFilmPlotBadly/comments/igagli/after_world_destroying_virus_breaks_out_two/
"Kid hallucinates his mouse talking to him.",Ashlesdire,409,https://reddit.com/r/ExplainAFilmPlotBadly/comments/ggzd42/kid_hallucinates_his_mouse_talking_to_him/
"Narnia, but starring a bored girl",[deleted],412,https://reddit.com/r/ExplainAFilmPlotBadly/comments/el48rq/narnia_but_starring_a_bored_girl/
"Hungry dude sends guy to tell people he is hungry.",BigECheese1,416,https://reddit.com/r/ExplainAFilmPlotBadly/comments/k3wfsv/hungry_dude_sends_guy_to_tell_people_he_is_hungry/
"A man travels a great distance to save his wife from being miserable forever",[deleted],417,https://reddit.com/r/ExplainAFilmPlotBadly/comments/e0ibh4/a_man_travels_a_great_distance_to_save_his_wife/
"A dad breaks his promise and never sees his daughter again. He doesn't even tell her his decision in person.",MintClicker,409,https://reddit.com/r/ExplainAFilmPlotBadly/comments/ex8tgm/a_dad_breaks_his_promise_and_never_sees_his/
"Two best friends set out to retrieve the lost/stolen crown of their god.",M1DZ_ON1Y,413,https://reddit.com/r/ExplainAFilmPlotBadly/comments/evo91m/two_best_friends_set_out_to_retrieve_the/
"Illegal immigrant fights other illegal immigrants",god_of_thunder08,413,https://reddit.com/r/ExplainAFilmPlotBadly/comments/k9r8cv/illegal_immigrant_fights_other_illegal_immigrants/
"Genocidal leader is praised for stopping another genocidal leader",ThrowawayBonito,414,https://reddit.com/r/ExplainAFilmPlotBadly/comments/fggweh/genocidal_leader_is_praised_for_stopping_another/
"An ageing alcoholic rapist will stop at no end to hunt down and murder a group of four year olds. But an unlikely act of kindness compels him to instead keep one as a sex slave.",Noporopo79,406,https://reddit.com/r/ExplainAFilmPlotBadly/comments/dfah9h/an_ageing_alcoholic_rapist_will_stop_at_no_end_to/
"A cool guy tries to hook up some loser with a chick, for his own sake.",wilhoe,412,https://reddit.com/r/ExplainAFilmPlotBadly/comments/c8mnoe/a_cool_guy_tries_to_hook_up_some_loser_with_a/
"Guy crash lands his spaceship on a foreign planet. Some inhabitants welcome him but some don't. While trying to return to his home planet, to his shock, he eventually finds out that the planet he's on is actually the planet he's from!",staysharp87,413,https://reddit.com/r/ExplainAFilmPlotBadly/comments/1j5claw/guy_crash_lands_his_spaceship_on_a_foreign_planet/
"Old man get implants and then makes up with his brother.",jonahbradenday,411,https://reddit.com/r/ExplainAFilmPlotBadly/comments/hpcw70/old_man_get_implants_and_then_makes_up_with_his/
"(Show) A young cooking talent is taken advantage of by his greedy boss.",reversecard420,411,https://reddit.com/r/ExplainAFilmPlotBadly/comments/goltfo/show_a_young_cooking_talent_is_taken_advantage_of/
"The protagonist learns the art of wielding sticks from an old man. Despite having years less of training than his opponents, he overpowers them with incredible talent and strength. The pupil then kills his mentor and he becomes a champion in the end.",RagingAfros,407,https://reddit.com/r/ExplainAFilmPlotBadly/comments/ewa1rm/the_protagonist_learns_the_art_of_wielding_sticks/
"Aliens chase boy for his glasses and to get their single dice back.",TheRealSilverBlade,414,https://reddit.com/r/ExplainAFilmPlotBadly/comments/dxu8j0/aliens_chase_boy_for_his_glasses_and_to_get_their/
"A train hitting a pedestrian leads to a man trying to take down a company for justice",[deleted],408,https://reddit.com/r/ExplainAFilmPlotBadly/comments/j12p0g/a_train_hitting_a_pedestrian_leads_to_a_man/
"Guy kills dude on his roof, steals his stuff, his jacket, and his ride",ExtravagntMarshmalow,408,https://reddit.com/r/ExplainAFilmPlotBadly/comments/ebm5q3/guy_kills_dude_on_his_roof_steals_his_stuff_his/
"Doctor falls asleep while man tells story of the time he saved the President.",spyderacidburn,408,https://reddit.com/r/ExplainAFilmPlotBadly/comments/dc016j/doctor_falls_asleep_while_man_tells_story_of_the/
"Ugly Loner has a roommate who is a literal ass. Some fuckwad encourages him to get married",kmr222,410,https://reddit.com/r/ExplainAFilmPlotBadly/comments/ajdxf4/ugly_loner_has_a_roommate_who_is_a_literal_ass/
"Vegan stops tribal war started when billionaire tries to corner the shit market",evostplght,409,https://reddit.com/r/ExplainAFilmPlotBadly/comments/jfr5tn/vegan_stops_tribal_war_started_when_billionaire/
"a bitch gets hit with a bus",[deleted],412,https://reddit.com/r/ExplainAFilmPlotBadly/comments/jenm44/a_bitch_gets_hit_with_a_bus/
"Black man rises to power in a white man’s world, does better job than they ever did, screws them out of their money (based on a true story).",silverbonez,404,https://reddit.com/r/ExplainAFilmPlotBadly/comments/dxks4y/black_man_rises_to_power_in_a_white_mans_world/
"Illegal immigrants abduct children, brainwash American citizens and and release dangerous radiation over a small town, but the US government is chill with it after the foreigners lay down a funky jam",rapiertwit,408,https://reddit.com/r/ExplainAFilmPlotBadly/comments/jt7i05/illegal_immigrants_abduct_children_brainwash/
"Boy falls in love with a stranger after she steals his house plant",ProjectEnderjack,413,https://reddit.com/r/ExplainAFilmPlotBadly/comments/d52v3q/boy_falls_in_love_with_a_stranger_after_she/
"D&amp;D is 'historically accurate'",L_Circe,407,https://reddit.com/r/ExplainAFilmPlotBadly/comments/iaymh5/dd_is_historically_accurate/
"A Los Angeles bus driver skips several stops on her route.",Trevellation,409,https://reddit.com/r/ExplainAFilmPlotBadly/comments/i7vufb/a_los_angeles_bus_driver_skips_several_stops_on/
"A girl kills the first person she sees in a new country, than meets three strangers to kill again",MTTR40,405,https://reddit.com/r/ExplainAFilmPlotBadly/comments/eqfxvx/a_girl_kills_the_first_person_she_sees_in_a_new/
"Peta frees some monkeys, a few weeks later its not cool",A_zuma2007,405,https://reddit.com/r/ExplainAFilmPlotBadly/comments/jxq0ic/peta_frees_some_monkeys_a_few_weeks_later_its_not/
"A man gets a boo boo. He then slices off a guy’s fingers for killing his son.",please-dont-shoot,402,https://reddit.com/r/ExplainAFilmPlotBadly/comments/j7y29b/a_man_gets_a_boo_boo_he_then_slices_off_a_guys/
"Magical big guy cures guy's dick by grabbing it , but he just wants to die.",regular_gian,405,https://reddit.com/r/ExplainAFilmPlotBadly/comments/fk52fa/magical_big_guy_cures_guys_dick_by_grabbing_it/
"Cursed boy stops a fight between a furry and a empowered woman by beating both and watches what happens next",pedroakira,405,https://reddit.com/r/ExplainAFilmPlotBadly/comments/favbq6/cursed_boy_stops_a_fight_between_a_furry_and_a/
"A journalist becomes intimate roommates with a human eating creature",[deleted],405,https://reddit.com/r/ExplainAFilmPlotBadly/comments/ilwxlg/a_journalist_becomes_intimate_roommates_with_a/
"High school kid buys a scuba suit and gets tortured",schlappothetappo,404,https://reddit.com/r/ExplainAFilmPlotBadly/comments/g76a55/high_school_kid_buys_a_scuba_suit_and_gets/
"The tale of a queen letting her hair down over two movies.",Pitch_Blease61,401,https://reddit.com/r/ExplainAFilmPlotBadly/comments/f5rgew/the_tale_of_a_queen_letting_her_hair_down_over/
"Man nearly dooms entire city by not disposing of his trash properly, but fixes it with a bomb and a motorcycle.",[deleted],399,https://reddit.com/r/ExplainAFilmPlotBadly/comments/f3np41/man_nearly_dooms_entire_city_by_not_disposing_of/
"Matt Damon metaphorically eats shit immediately followed by Matt Damon literally eating shit",Vote_Karl_Marx,401,https://reddit.com/r/ExplainAFilmPlotBadly/comments/bdsnr0/matt_damon_metaphorically_eats_shit_immediately/
"Law enforcement is jealous of a foreigner who is loved more by a child.",RealOzome,397,https://reddit.com/r/ExplainAFilmPlotBadly/comments/ki8qst/law_enforcement_is_jealous_of_a_foreigner_who_is/
"A French woman burns down her own property for revenge",iamyourgodwaitno,396,https://reddit.com/r/ExplainAFilmPlotBadly/comments/gf7p5o/a_french_woman_burns_down_her_own_property_for/
