title,author,upvotes,permalink
"A man inherits his uncle's jewelry, then gets rid of it.",KingdaToro,291,https://reddit.com/r/ExplainAFilmPlotBadly/comments/8l3feg/a_man_inherits_his_uncles_jewelry_then_gets_rid/
"Guy needs to not sleep with a hot young woman to make sure he keeps existing. Oh, and there’s a dance with Chuck Berry music and some jumps in time.",HeftyButton,287,https://reddit.com/r/ExplainAFilmPlotBadly/comments/1lwyfm3/guy_needs_to_not_sleep_with_a_hot_young_woman_to/
"A man is in a love triangle with two immortals.",nalk201,289,https://reddit.com/r/ExplainAFilmPlotBadly/comments/kepu1i/a_man_is_in_a_love_triangle_with_two_immortals/
"Two imposters visit a sports business owner, overpay for merchandise have dinner and then kill a bunch of people over bad manners",draffin75,291,https://reddit.com/r/ExplainAFilmPlotBadly/comments/kbayfq/two_imposters_visit_a_sports_business_owner/
"Two forty-year-olds get their lives turned upside down start a company.",KALIsthenicsLinux,292,https://reddit.com/r/ExplainAFilmPlotBadly/comments/jmfhtv/two_fortyyearolds_get_their_lives_turned_upside/
"Tom Cruise is wanted dead or alive",TheFantasticXman1,287,https://reddit.com/r/ExplainAFilmPlotBadly/comments/fuietm/tom_cruise_is_wanted_dead_or_alive/
"A man becomes a terrorist because he doesn't understand that a payphone can't accept incoming calls.",EmpireStrikes1st,289,https://reddit.com/r/ExplainAFilmPlotBadly/comments/nrgfnx/a_man_becomes_a_terrorist_because_he_doesnt/
"A girl literally uses sex as a weapon",Blastspark01,285,https://reddit.com/r/ExplainAFilmPlotBadly/comments/mpz45f/a_girl_literally_uses_sex_as_a_weapon/
"If a man is passionate about something, likes doing it, spends a lot of time contemplating about it and finally gives his 100% he will succeed, but only the first time. The next time he tries doing it he will fail horribly.",Andy-Banner,289,https://reddit.com/r/ExplainAFilmPlotBadly/comments/l6wkrl/if_a_man_is_passionate_about_something_likes/
"Girl cures furry with the power of love",[deleted],291,https://reddit.com/r/ExplainAFilmPlotBadly/comments/kj5at9/girl_cures_furry_with_the_power_of_love/
"Steve Carrel's nephew ends up with his wife in the end",426strings,287,https://reddit.com/r/ExplainAFilmPlotBadly/comments/g4vpmc/steve_carrels_nephew_ends_up_with_his_wife_in_the/
"Kid goes on a psychedelic trip and controls reality just to stop a bully",FullyAutomaticBanana,288,https://reddit.com/r/ExplainAFilmPlotBadly/comments/c2fxdc/kid_goes_on_a_psychedelic_trip_and_controls/
"A guy flies powerful people to his private island and endangers minors there, aided by a female accomplice. He dies under unusual circumstances from something around his neck, even though there were two people nearby who are supposed to protect people.",HeftyButton,289,https://reddit.com/r/ExplainAFilmPlotBadly/comments/1m9tl8l/a_guy_flies_powerful_people_to_his_private_island/
"Creepy guy breaks into kids’ house and tries to show them his way of having a good time",Isaac_Ludwig666,287,https://reddit.com/r/ExplainAFilmPlotBadly/comments/mct1pj/creepy_guy_breaks_into_kids_house_and_tries_to/
"Guy can’t get the girl to like him so he tries to commit suicide a bunch of times",Anon-Ymous929,289,https://reddit.com/r/ExplainAFilmPlotBadly/comments/ldpa9r/guy_cant_get_the_girl_to_like_him_so_he_tries_to/
"Dude saves a town by catching a monkey",Shagroon,291,https://reddit.com/r/ExplainAFilmPlotBadly/comments/fkzvnp/dude_saves_a_town_by_catching_a_monkey/
"Guy and his friends kill his dad because of a broken MP3 player",jacky2149,287,https://reddit.com/r/ExplainAFilmPlotBadly/comments/beouyt/guy_and_his_friends_kill_his_dad_because_of_a/
"A man loses the will to live after a child ruins his only book",FryingPanHero,289,https://reddit.com/r/ExplainAFilmPlotBadly/comments/cyevp7/a_man_loses_the_will_to_live_after_a_child_ruins/
"Man stops himself from killing himself, but then kills himself anyway.",NuclearTalon,290,https://reddit.com/r/ExplainAFilmPlotBadly/comments/9xlpbw/man_stops_himself_from_killing_himself_but_then/
"Star-crossed lovers try to meet, girl arrives too early, guy arrives too late. The logistics get really complicated and they decide to forget about it.",BeyondMeta,288,https://reddit.com/r/ExplainAFilmPlotBadly/comments/mor25i/starcrossed_lovers_try_to_meet_girl_arrives_too/
"[TV Show] Man gets away with identity theft for many years. Also, workplace and relationship drama.",addledwalrus,288,https://reddit.com/r/ExplainAFilmPlotBadly/comments/f6rk7s/tv_show_man_gets_away_with_identity_theft_for/
"A janitor falls in love with an biologist while she’s in a coma. Later, he visits her at work and almost gets her fired. ",Reasonable-Truck-874,288,https://reddit.com/r/ExplainAFilmPlotBadly/comments/1f87a2p/a_janitor_falls_in_love_with_an_biologist_while/
"Self-employed business man is cheated out of payment by deadbeat couple",SchwiftyInHere,284,https://reddit.com/r/ExplainAFilmPlotBadly/comments/l7szll/selfemployed_business_man_is_cheated_out_of/
"An uptight man with strict dietary restrictions finds himself far from home. He is befriends a laid back guy, and a braindead oaf, who share his dietary restrictions. Together they take a road trip to get back to his girlfriend (whose father really hates him) so he can propose.",Y3C3NN3KMI1S,284,https://reddit.com/r/ExplainAFilmPlotBadly/comments/l34u19/an_uptight_man_with_strict_dietary_restrictions/
"Despite serving together in the military, characters played by Tom Hanks and Gary Sinise are separated then work together to be reunited at home",zehjwqvno,285,https://reddit.com/r/ExplainAFilmPlotBadly/comments/kgmmor/despite_serving_together_in_the_military/
"TV Show: Immigrant with hundreds of personalities lives secretly with a seemingly normal family.",Milkywaycannonball,284,https://reddit.com/r/ExplainAFilmPlotBadly/comments/k6u4j3/tv_show_immigrant_with_hundreds_of_personalities/
"A man's descendant is kidnapped by an Australian gang, leading him to a mentally insane woman who can help him",[deleted],289,https://reddit.com/r/ExplainAFilmPlotBadly/comments/c69m4h/a_mans_descendant_is_kidnapped_by_an_australian/
"A very old pedophile bangs a girl who's into necrophilia and beastiality.",stoygeist,281,https://reddit.com/r/ExplainAFilmPlotBadly/comments/ad1c9i/a_very_old_pedophile_bangs_a_girl_whos_into/
"Protagonist rapes someone and in the end takes away what everyone in the world has ever wanted.",[deleted],280,https://reddit.com/r/ExplainAFilmPlotBadly/comments/mtgllw/protagonist_rapes_someone_and_in_the_end_takes/
"(anime) why the hell don't you have a water bottle and thermos on you at all times?!?! It would eliminate 95% of the conflict in the show.",12jonboy12,284,https://reddit.com/r/ExplainAFilmPlotBadly/comments/lnfpx6/anime_why_the_hell_dont_you_have_a_water_bottle/
"Cancer patient kidnaps a child and is arrested while eating cereal. He escapes the arrest because of shit that already happened.",TownIdiot25,282,https://reddit.com/r/ExplainAFilmPlotBadly/comments/khveyp/cancer_patient_kidnaps_a_child_and_is_arrested/
"A kid burns his house with his mother inside, and goes for an RV trip",yaeran,285,https://reddit.com/r/ExplainAFilmPlotBadly/comments/kf3bkd/a_kid_burns_his_house_with_his_mother_inside_and/
"6 different versions of the same insect fight fat Elon Musk with a USB stick.",TheRealSilverBlade,282,https://reddit.com/r/ExplainAFilmPlotBadly/comments/bttj5q/6_different_versions_of_the_same_insect_fight_fat/
"Toys can move when no one is around, they have to be careful to get back to the right place before they're seen. A new toy has been added to the household, an over the top visitor from space who doesn't realize they're a toy, there's also jealousy from the existing toys.",ColorfulShards,287,https://reddit.com/r/ExplainAFilmPlotBadly/comments/odrnuc/toys_can_move_when_no_one_is_around_they_have_to/
"Actors get fired, take a real job, and face a plethora of problems. One forgets to shoot up.",stormbee3210,279,https://reddit.com/r/ExplainAFilmPlotBadly/comments/mjdemr/actors_get_fired_take_a_real_job_and_face_a/
"A woman who should know better has sex with a feral hobo she barely knows.",EvilDog77,281,https://reddit.com/r/ExplainAFilmPlotBadly/comments/m131uq/a_woman_who_should_know_better_has_sex_with_a/
"A man accidentally commits many felonies while just trying to enjoy his trip",[deleted],283,https://reddit.com/r/ExplainAFilmPlotBadly/comments/lt9pei/a_man_accidentally_commits_many_felonies_while/
"A man helps advance a young woman's career after his neighbor performs an unspeakably ugly act toward her. Meanwhile, the antagonist promotes a skin care regimen.",LegendaryLeonard,282,https://reddit.com/r/ExplainAFilmPlotBadly/comments/ch9m6v/a_man_helps_advance_a_young_womans_career_after/
"A boy gets seduced by a cougar, but comes out of the closet in the end.",Leeuw96,283,https://reddit.com/r/ExplainAFilmPlotBadly/comments/c3or5e/a_boy_gets_seduced_by_a_cougar_but_comes_out_of/
"Bonnie and Clyde set in a futuristic time period with a minimalist aesthetic.",HereLiesMyFinalWor-,284,https://reddit.com/r/ExplainAFilmPlotBadly/comments/ktc7fw/bonnie_and_clyde_set_in_a_futuristic_time_period/
"(TV) - Welcome to the Franchise! Here's your skin tight body suit no one else wears: The Prequel!",timeshaper,279,https://reddit.com/r/ExplainAFilmPlotBadly/comments/kflf2r/tv_welcome_to_the_franchise_heres_your_skin_tight/
"A boy named Andy has a toy that comes to life",[deleted],285,https://reddit.com/r/ExplainAFilmPlotBadly/comments/d3bzne/a_boy_named_andy_has_a_toy_that_comes_to_life/
"The leader of a small colony and a warrior from a distant land must put aside their differences in order to escape the lair of a murderous giant.",CapLFSternn,281,https://reddit.com/r/ExplainAFilmPlotBadly/comments/b2z0u2/the_leader_of_a_small_colony_and_a_warrior_from_a/
"Guy has a wife. She's terrible. Guy has a girlfriend. She's terrible also. The ladies try to kill each other but, he's the one that dies.",Robbbylight,278,https://reddit.com/r/ExplainAFilmPlotBadly/comments/1iudsjx/guy_has_a_wife_shes_terrible_guy_has_a_girlfriend/
"A racist man hires an assassin to kill his daughter's husband in order to replace him with handsome white guy.",Bobpencil1,282,https://reddit.com/r/ExplainAFilmPlotBadly/comments/1h3f9bu/a_racist_man_hires_an_assassin_to_kill_his/
"A title hinting at a showdown between two guys. Turns out they don’t really fight each other anyways, but instead becomes friends &amp; battles a flame ogre with the help of some woman they met on the way.",ImmortalEmergence,280,https://reddit.com/r/ExplainAFilmPlotBadly/comments/l5l2ve/a_title_hinting_at_a_showdown_between_two_guys/
"Military has a hard time killing a bug.",Logesterator,280,https://reddit.com/r/ExplainAFilmPlotBadly/comments/kzp9a9/military_has_a_hard_time_killing_a_bug/
"Man impersonates a popular person and gets shot down by the government and fights someone with a gambling addiction",dragonmemeZ,280,https://reddit.com/r/ExplainAFilmPlotBadly/comments/d7vk7r/man_impersonates_a_popular_person_and_gets_shot/
"Man wants to preserve history, ruins every ancient place he goes in.",Tom-333,280,https://reddit.com/r/ExplainAFilmPlotBadly/comments/czf56c/man_wants_to_preserve_history_ruins_every_ancient/
"Man ends eternal winter by hooking up with a chick (not Frozen)",FetusGenius,280,https://reddit.com/r/ExplainAFilmPlotBadly/comments/cx265d/man_ends_eternal_winter_by_hooking_up_with_a/
"Man haunts himself only to find out later that he was warning himself from becoming the ghost.",The-Weekdays,278,https://reddit.com/r/ExplainAFilmPlotBadly/comments/c0tumr/man_haunts_himself_only_to_find_out_later_that_he/
"Our protagonist delights in peeping upskirts of an underage girl, but when he falls for the girl, attempts to impress her backfire when he gets SA'd by bigger, stronger dudes. Ultimately, after all his friends and teachers support him in an unsuccessful suicide attempt that leaves him brain-damaged,",TomahawkA5,276,https://reddit.com/r/ExplainAFilmPlotBadly/comments/1l4j9l8/our_protagonist_delights_in_peeping_upskirts_of/
"[TV Show] Basically people are angry at each other over who has the best rocks.",[deleted],280,https://reddit.com/r/ExplainAFilmPlotBadly/comments/l2m87q/tv_show_basically_people_are_angry_at_each_other/
"A guy hates his job. He goes traveling and finds a new lease on life, which is mainly focused on committing a series of crimes. He makes alot of people confused and unhappy, including his employees, a bunch of children, and himself. Still gets the girl in the end.",HazelGhost,282,https://reddit.com/r/ExplainAFilmPlotBadly/comments/1inm13s/a_guy_hates_his_job_he_goes_traveling_and_finds_a/
"An early example of why doing quarantine with your family is a really bad idea",hotaku_kun,280,https://reddit.com/r/ExplainAFilmPlotBadly/comments/lvwc4x/an_early_example_of_why_doing_quarantine_with/
"Hero turns back time to get a second chance at saving his girlfriend.",_nobodyreally,279,https://reddit.com/r/ExplainAFilmPlotBadly/comments/o47o1j/hero_turns_back_time_to_get_a_second_chance_at/
"'I don't believe in Ghosts!' -The Ghost",Rigistroni,277,https://reddit.com/r/ExplainAFilmPlotBadly/comments/mglgif/i_dont_believe_in_ghosts_the_ghost/
"A girl goes on a European vacation with her friend, but her overprotective father won't stop following after her",TransPM,277,https://reddit.com/r/ExplainAFilmPlotBadly/comments/kxoe6d/a_girl_goes_on_a_european_vacation_with_her/
"Man becomes his worst enemy",[deleted],281,https://reddit.com/r/ExplainAFilmPlotBadly/comments/jl5len/man_becomes_his_worst_enemy/
"Caffeine rat and man stop merging issues in the city.",Master_Freeze,275,https://reddit.com/r/ExplainAFilmPlotBadly/comments/hht0zl/caffeine_rat_and_man_stop_merging_issues_in_the/
"Teen says moo, a bunch of people die",eddbruh,278,https://reddit.com/r/ExplainAFilmPlotBadly/comments/githry/teen_says_moo_a_bunch_of_people_die/
"Dude forbids a song to be played to prevent himself from remembering his lover",426strings,277,https://reddit.com/r/ExplainAFilmPlotBadly/comments/hd94lr/dude_forbids_a_song_to_be_played_to_prevent/
"Socially awkward girl tries to protect her sister, ends up overthrowing the government",blue_navy,278,https://reddit.com/r/ExplainAFilmPlotBadly/comments/cbdlz7/socially_awkward_girl_tries_to_protect_her_sister/
"Jimmy Neutron and his jock friend with the help of some science buddies fight a evil millennial who hates boomers",real_King_Diablo,275,https://reddit.com/r/ExplainAFilmPlotBadly/comments/l4nywd/jimmy_neutron_and_his_jock_friend_with_the_help/
"Man destroys his planet because he didn't want to share it with his sister because she broke his favorite toy",samhofs,277,https://reddit.com/r/ExplainAFilmPlotBadly/comments/dool8y/man_destroys_his_planet_because_he_didnt_want_to/
"After almost four hours of semi-intense drama, everyone just remember the last line of dialogue.",toru_okada_4ever,274,https://reddit.com/r/ExplainAFilmPlotBadly/comments/d1ojqp/after_almost_four_hours_of_semiintense_drama/
"A typically horror oriented franchise does a superhero movie because trends = money",MrShadowKing2020,275,https://reddit.com/r/ExplainAFilmPlotBadly/comments/miorm5/a_typically_horror_oriented_franchise_does_a/
"Somehow, in the middle of this movie, a Giant, legendary, Lovecraftian monster was killed, off screen, and all it gets is a melancholy eulogy.",ghostpanther218,274,https://reddit.com/r/ExplainAFilmPlotBadly/comments/m60h2t/somehow_in_the_middle_of_this_movie_a_giant/
"Alice in Horror land",oli-avenger22,273,https://reddit.com/r/ExplainAFilmPlotBadly/comments/k0qn67/alice_in_horror_land/
"Fat drunk “states rights” supporter shoots a horse in the face while the young girl who owns it screams, after abandoning a Martian with a concussion",adscr1,274,https://reddit.com/r/ExplainAFilmPlotBadly/comments/famklj/fat_drunk_states_rights_supporter_shoots_a_horse/
"Local daily wage earner has to face the wrath of the Mob due to a series of misunderstandings",kriznone,272,https://reddit.com/r/ExplainAFilmPlotBadly/comments/kv50qx/local_daily_wage_earner_has_to_face_the_wrath_of/
"Employees at an energy company break the law and accidentaly discover much more efficient way to power the planet.",Draper-Durden-619,273,https://reddit.com/r/ExplainAFilmPlotBadly/comments/b035i4/employees_at_an_energy_company_break_the_law_and/
"Man kills a foreign contractor, takes his vehicle, assumes his identity, gets arrested, gets broken out, and then relocates outside the jurisdiction of U.S. extradition treaties.",Grays42,271,https://reddit.com/r/ExplainAFilmPlotBadly/comments/azfakw/man_kills_a_foreign_contractor_takes_his_vehicle/
"In this film from the 1970s, a group of friends go on an unexpectedly harrowing river rafting trip, where they encounter sadistic foes. One of the characters undergoes a humiliating experience, but all the protagonists survive. The catchy theme song features a guitar and a banjo.",NinjaSimone,272,https://reddit.com/r/ExplainAFilmPlotBadly/comments/1hp8tzo/in_this_film_from_the_1970s_a_group_of_friends_go/
"Noblewoman joins the working class to avoid assassination.",MrShadowKing2020,272,https://reddit.com/r/ExplainAFilmPlotBadly/comments/ma4175/noblewoman_joins_the_working_class_to_avoid/
"An man flirts with himself. Also, existentialism.",MrShadowKing2020,273,https://reddit.com/r/ExplainAFilmPlotBadly/comments/m76ch3/an_man_flirts_with_himself_also_existentialism/
"A drug addict fight a mathematician with the help of a doctor, a fat naked bureaucrat and a indegenious woman",dexterlab97,271,https://reddit.com/r/ExplainAFilmPlotBadly/comments/dgc4mx/a_drug_addict_fight_a_mathematician_with_the_help/
"Woman can't get over her boyfriend's death so she abducts a man against his will and forces him to pretend he is the dead boyfriend.",SaskiaViking,271,https://reddit.com/r/ExplainAFilmPlotBadly/comments/mefupf/woman_cant_get_over_her_boyfriends_death_so_she/
"A movie which jumps through different points in time to tell a interconnected story, and ends with a man flying a tree into the sun.",Rosecitydyes,271,https://reddit.com/r/ExplainAFilmPlotBadly/comments/mc7jlr/a_movie_which_jumps_through_different_points_in/
"One woman is willing to do whatever it takes to get her former lover back, including feeding him a very special diet and letting him 'borrow' a very special 'suit' from her husband",Send_Me_Dik-diks,268,https://reddit.com/r/ExplainAFilmPlotBadly/comments/mlxphp/one_woman_is_willing_to_do_whatever_it_takes_to/
"Kind family chooses animal over starving children, other humans attempt to legally steal said animal.",coys223,268,https://reddit.com/r/ExplainAFilmPlotBadly/comments/lr463j/kind_family_chooses_animal_over_starving_children/
"film about how they captured the orchestrator of the final solution and bought him to trial",Burgeroncheese,272,https://reddit.com/r/ExplainAFilmPlotBadly/comments/hb1mog/film_about_how_they_captured_the_orchestrator_of/
"A corpse is smuggled around",Mindgameninja,271,https://reddit.com/r/ExplainAFilmPlotBadly/comments/g8s15q/a_corpse_is_smuggled_around/
"A popular girl, a jock, a loner, a nerd, and a weird girl get detention. Whacky high school shenanigans and drama ensue.",[deleted],269,https://reddit.com/r/ExplainAFilmPlotBadly/comments/djwcb6/a_popular_girl_a_jock_a_loner_a_nerd_and_a_weird/
"A weasel sadly died but then they lived",Procyon_Iotor,269,https://reddit.com/r/ExplainAFilmPlotBadly/comments/c9a744/a_weasel_sadly_died_but_then_they_lived/
"[TV] Ancient Kung Fu master recruits teenagers to prevent a fashion designer from obtaining adequate medical care for his wife.",[deleted],265,https://reddit.com/r/ExplainAFilmPlotBadly/comments/a6hqed/tv_ancient_kung_fu_master_recruits_teenagers_to/
"man murders a dentist, his father figure, his girlfriend, then accidentally himself all in the same way",iLoveLoveLoveLove,268,https://reddit.com/r/ExplainAFilmPlotBadly/comments/1hvttzk/man_murders_a_dentist_his_father_figure_his/
"[META] Should we have a rule that movies have to be out of theaters for a certain amount of time so there aren't any spoliers?",Fromthe802,272,https://reddit.com/r/ExplainAFilmPlotBadly/comments/blpqde/meta_should_we_have_a_rule_that_movies_have_to_be/
"A jealous billionaire suffering from ptsd kills an old colleague of his wife for having a crush on her",ImKindaWrong,268,https://reddit.com/r/ExplainAFilmPlotBadly/comments/cfyiqt/a_jealous_billionaire_suffering_from_ptsd_kills/
"A wealthy redhead is supposed to marry the rich dude, but he sucks, so she gets with the uncultured dude who shows her that being poor is more fun.",[deleted],267,https://reddit.com/r/ExplainAFilmPlotBadly/comments/1kvgmfx/a_wealthy_redhead_is_supposed_to_marry_the_rich/
"Man lies to his hitmen to stay alive but backfires terribly after being humiliated on live tv",redditboy123451,269,https://reddit.com/r/ExplainAFilmPlotBadly/comments/m6ihbi/man_lies_to_his_hitmen_to_stay_alive_but/
"A former strong man is forced to come out of retirement to fight a nihilist of his own making",Allhaildegen,267,https://reddit.com/r/ExplainAFilmPlotBadly/comments/limem3/a_former_strong_man_is_forced_to_come_out_of/
"A movie about four men running a business that’s been beloved by children and adults for almost 40 years",Isaac_Ludwig666,269,https://reddit.com/r/ExplainAFilmPlotBadly/comments/l0ats2/a_movie_about_four_men_running_a_business_thats/
"Actors sing showtunes and take down a Mexican gang leader",TheNerdyAnarchist,264,https://reddit.com/r/ExplainAFilmPlotBadly/comments/ekkpim/actors_sing_showtunes_and_take_down_a_mexican/
"A dude with a mental disability beats himself up",xXYoProMamaXx,265,https://reddit.com/r/ExplainAFilmPlotBadly/comments/c38adk/a_dude_with_a_mental_disability_beats_himself_up/
"A fun girls trip is nearly ruined by a clingy S.O., a bumbling truck driver, and ruggedly handsome Australian.",CapLFSternn,263,https://reddit.com/r/ExplainAFilmPlotBadly/comments/b5ihjv/a_fun_girls_trip_is_nearly_ruined_by_a_clingy_so/
"Two minors must suddenly go into the family business to aid their parents",MrShadowKing2020,268,https://reddit.com/r/ExplainAFilmPlotBadly/comments/m25m5a/two_minors_must_suddenly_go_into_the_family/
"A friendly ghost helps a young boy with mental health issues",l3landgaunt,264,https://reddit.com/r/ExplainAFilmPlotBadly/comments/itvn09/a_friendly_ghost_helps_a_young_boy_with_mental/
"Man becomes the best reality show star of all time",robotdepapel,267,https://reddit.com/r/ExplainAFilmPlotBadly/comments/hqbrtj/man_becomes_the_best_reality_show_star_of_all_time/
"Fantastic Four fights evil Tony Stark",TheRealSilverBlade,265,https://reddit.com/r/ExplainAFilmPlotBadly/comments/dn914u/fantastic_four_fights_evil_tony_stark/
"A sweet high school girl falls in love with a violent older man who's inappropriately using her. She stands by him even when he cheats on her and eventually leaves her for another woman.",mercutio48,264,https://reddit.com/r/ExplainAFilmPlotBadly/comments/1k2p5rk/a_sweet_high_school_girl_falls_in_love_with_a/
"A woman is blamed for the death of New York's biggest celebrity, who jumped off a building when he couldn't handle the fame.",BoxMorton,266,https://reddit.com/r/ExplainAFilmPlotBadly/comments/1hl1syu/a_woman_is_blamed_for_the_death_of_new_yorks/
"A former member of Antifa is convinced to rejoin by his ex-girlfriend",EmpireStrikes1st,264,https://reddit.com/r/ExplainAFilmPlotBadly/comments/ns5346/a_former_member_of_antifa_is_convinced_to_rejoin/
"After being taken hostage, two men must learn to get along and escape before their family flees the area.",[deleted],263,https://reddit.com/r/ExplainAFilmPlotBadly/comments/npsj1n/after_being_taken_hostage_two_men_must_learn_to/
"Giving birth must have been really easy all 3 times.",embarrased_to_Ask_42,266,https://reddit.com/r/ExplainAFilmPlotBadly/comments/nans48/giving_birth_must_have_been_really_easy_all_3/
"A white man breaks into an underage black girls bedroom and doesn’t get shot. Probably a good thing since he’s the step son of the mayor.",[deleted],265,https://reddit.com/r/ExplainAFilmPlotBadly/comments/dkyom6/a_white_man_breaks_into_an_underage_black_girls/
"That schizophrenic divorcee, that car thief, that worm farmer, that animal trainer and that pirate of the Caribbean try to sell their heist gem but get cash only in the sequel!",Doubletakkes,267,https://reddit.com/r/ExplainAFilmPlotBadly/comments/cggw95/that_schizophrenic_divorcee_that_car_thief_that/
"An unexpected new baby turns a man and his coworkers’ lives inside out. Can the office cat lady put a stop to the hijinks before it all goes off in a bang?",vixous,263,https://reddit.com/r/ExplainAFilmPlotBadly/comments/1hyxe0j/an_unexpected_new_baby_turns_a_man_and_his/
"TV show star quits show after sailing accident",ricarleite1,263,https://reddit.com/r/ExplainAFilmPlotBadly/comments/oebzak/tv_show_star_quits_show_after_sailing_accident/
"There's always a bigger fish",Rigistroni,263,https://reddit.com/r/ExplainAFilmPlotBadly/comments/j58gdj/theres_always_a_bigger_fish/
"Bunch of geeks take over micronation.",[deleted],263,https://reddit.com/r/ExplainAFilmPlotBadly/comments/j4xgxe/bunch_of_geeks_take_over_micronation/
"Wardrobe Malfunction During World War II",KFY,265,https://reddit.com/r/ExplainAFilmPlotBadly/comments/ajnif8/wardrobe_malfunction_during_world_war_ii/
"A man fakes his death, then comes back years later to be verbally abusive to his ex-girlfriend and break up her wedding.",ladrac1,260,https://reddit.com/r/ExplainAFilmPlotBadly/comments/1hhehqq/a_man_fakes_his_death_then_comes_back_years_later/
"Two magical entities stop a war and were attempted to be assassinated, a kid changes his birth father.",BenTheKingApple,263,https://reddit.com/r/ExplainAFilmPlotBadly/comments/lqiol1/two_magical_entities_stop_a_war_and_were/
