title,author,upvotes,permalink
"A son motorboats his mom while the sister rides her. Then there is a little family bondage. Finally the whole thing culminates in the dad assisting with some big black penetration.",BaconConnoisseur,3782,https://reddit.com/r/ExplainAFilmPlotBadly/comments/ezzcsu/a_son_motorboats_his_mom_while_the_sister_rides/
"Man is forced to participate in the rescue of a hostage by the government, that has turned his residence into a refugee camp",Skybots10,2653,https://reddit.com/r/ExplainAFilmPlotBadly/comments/efkrwa/man_is_forced_to_participate_in_the_rescue_of_a/
"Boy goes on a trip to meet his family and leaves once he ensures two of his relatives are going to have sex",thefilthyape,2133,https://reddit.com/r/ExplainAFilmPlotBadly/comments/dncgrp/boy_goes_on_a_trip_to_meet_his_family_and_leaves/
"In pursuit of ultimate power, a purple being must have a young woman sacrifice. At the end of the film, the purple being achieves ultimate power, but is severely wounded in the chest by a vengeful prince.",jsilvy,1982,https://reddit.com/r/ExplainAFilmPlotBadly/comments/dptapg/in_pursuit_of_ultimate_power_a_purple_being_must/
"Let's just ban Infinity War/Endgame posts for good, yes?",[deleted],1954,https://reddit.com/r/ExplainAFilmPlotBadly/comments/e972w2/lets_just_ban_infinity_warendgame_posts_for_good/
"Little guy works overtime while also stealing body parts from his dead coworkers before ditching his job to go on a cruise with his unconscious girlfriend",davidfromthelobster,1940,https://reddit.com/r/ExplainAFilmPlotBadly/comments/e1vvcf/little_guy_works_overtime_while_also_stealing/
"An overweight loner with poor hygiene and social skills goes on a quest to get rid of the minorities invading his homeland.",Jdoggcrash,1702,https://reddit.com/r/ExplainAFilmPlotBadly/comments/dipxt5/an_overweight_loner_with_poor_hygiene_and_social/
"Fe-male",jsilvy,1677,https://reddit.com/r/ExplainAFilmPlotBadly/comments/eyfvjs/female/
"(TV Series) 112 year old man grooms 14 year old girl under the watchful eyes of her 16 year old brother.",Alpha741,1589,https://reddit.com/r/ExplainAFilmPlotBadly/comments/gvs80u/tv_series_112_year_old_man_grooms_14_year_old/
"Guys wife dies so he gets high.",Almym,1536,https://reddit.com/r/ExplainAFilmPlotBadly/comments/eac9iq/guys_wife_dies_so_he_gets_high/
"After a famous guy dies from constructive criticism, one of his fans abandons his homeless family and continues on the dead man’s legacy by manipulating a twink",night-moth,1531,https://reddit.com/r/ExplainAFilmPlotBadly/comments/1hcuqcc/after_a_famous_guy_dies_from_constructive/
"The big bad guy kills the main bad guy because he failed to kill their bad guy who was almost killed trying to kill a bad guy.",[deleted],1493,https://reddit.com/r/ExplainAFilmPlotBadly/comments/fmhxjk/the_big_bad_guy_kills_the_main_bad_guy_because_he/
"An old man and his fresh, young partner are tailing a madman, who has been punishing people who exemplify the deadly sins in morbidly fitting ways. It all comes to a head in the dessert, where he reveals wrath and envy are the final sins. ",Buttpounder90,1478,https://reddit.com/r/ExplainAFilmPlotBadly/comments/1hygzug/an_old_man_and_his_fresh_young_partner_are/
"Skinny kid makes a black friend, father doesn’t approve.",Excaliber596,1455,https://reddit.com/r/ExplainAFilmPlotBadly/comments/jn8y36/skinny_kid_makes_a_black_friend_father_doesnt/
"Stylish black guy shows nerd how to spend less time online and get a girlfriend.",flocci_naucci,1359,https://reddit.com/r/ExplainAFilmPlotBadly/comments/dvc3uy/stylish_black_guy_shows_nerd_how_to_spend_less/
"Driver wrecks Ford.",FoX_MoLdY,1315,https://reddit.com/r/ExplainAFilmPlotBadly/comments/8ow2ws/driver_wrecks_ford/
"A retired Olympian is harassed by a telekinetic monster.",Dilarinee,1150,https://reddit.com/r/ExplainAFilmPlotBadly/comments/edn139/a_retired_olympian_is_harassed_by_a_telekinetic/
"Man murders dozens of locals by bombing their homes, then adds insult to injury by returning with more (and better) weapons to murder more of them. He comes clean by the end of the film.",[deleted],1124,https://reddit.com/r/ExplainAFilmPlotBadly/comments/dn1pdn/man_murders_dozens_of_locals_by_bombing_their/
"A school boy constantly gets a free pass for his rule breaking because his gay principle takes a liking to him",[deleted],1095,https://reddit.com/r/ExplainAFilmPlotBadly/comments/e600r8/a_school_boy_constantly_gets_a_free_pass_for_his/
"Man tries to buy a sculpture with his dad’s old stuff, but fails when his sister is caught crossdressing",[deleted],1098,https://reddit.com/r/ExplainAFilmPlotBadly/comments/d27ujz/man_tries_to_buy_a_sculpture_with_his_dads_old/
"An overweight chef slaughters a snow leopard because his turtle died",user7526,1055,https://reddit.com/r/ExplainAFilmPlotBadly/comments/iduahe/an_overweight_chef_slaughters_a_snow_leopard/
"A blonde woman named Elsa with Germanic origins has a famous scene where the phrase “Let it go” is uttered.",[deleted],1028,https://reddit.com/r/ExplainAFilmPlotBadly/comments/fh5yv3/a_blonde_woman_named_elsa_with_germanic_origins/
"Rich kid leaves home due to abusive uncle, gets adopted by nihilistic gay couple.",Cye_sonofAphrodite,1028,https://reddit.com/r/ExplainAFilmPlotBadly/comments/cgvs8t/rich_kid_leaves_home_due_to_abusive_uncle_gets/
"Dude sleeps with all of his employees",Iron_Nightingale,984,https://reddit.com/r/ExplainAFilmPlotBadly/comments/1hz8b22/dude_sleeps_with_all_of_his_employees/
"A weeb, 30s movie fan, ballerina, fat guy, cartoon, and middle schooler walk into a garage.",Pizzamaster199,954,https://reddit.com/r/ExplainAFilmPlotBadly/comments/doykrl/a_weeb_30s_movie_fan_ballerina_fat_guy_cartoon/
"Dancing is banned, but some teens do it anyway.",Actual-Astronaut-604,943,https://reddit.com/r/ExplainAFilmPlotBadly/comments/1em2s71/dancing_is_banned_but_some_teens_do_it_anyway/
"A group of midgets go on a hike to get rid of jewelry.",[deleted],935,https://reddit.com/r/ExplainAFilmPlotBadly/comments/9een34/a_group_of_midgets_go_on_a_hike_to_get_rid_of/
"A cowboy and his dog and 2 teens blow up their asthmatic father’s office",_B0b4_F3tt_,936,https://reddit.com/r/ExplainAFilmPlotBadly/comments/dodt5f/a_cowboy_and_his_dog_and_2_teens_blow_up_their/
"A father is widowed when a serial killer cannibalizes his wife and most of his children. Months later, after losing his last, disabled son due to a boating incident at sea, a mentally-challenged woman is his only hope to finding him.",jkk45k3jkl534l,899,https://reddit.com/r/ExplainAFilmPlotBadly/comments/9etmuz/a_father_is_widowed_when_a_serial_killer/
"A group of schoolteachers take their new friend to beat up a Holocaust survivor and his buddies",Someoneoverthere42,888,https://reddit.com/r/ExplainAFilmPlotBadly/comments/ijcsxb/a_group_of_schoolteachers_take_their_new_friend/
"A failed retired old white man teaches a promising black highschooler how to be like him",MYZS,881,https://reddit.com/r/ExplainAFilmPlotBadly/comments/dvpxti/a_failed_retired_old_white_man_teaches_a/
"This 2001 movie can be summarized as “put that thing back where it came from, or so help me!”",[deleted],878,https://reddit.com/r/ExplainAFilmPlotBadly/comments/i77qt5/this_2001_movie_can_be_summarized_as_put_that/
"The hero only wins because he saved before the final boss.",[deleted],867,https://reddit.com/r/ExplainAFilmPlotBadly/comments/ee62tr/the_hero_only_wins_because_he_saved_before_the/
"The town's most eligible bachelor gets turned down by a girl who's into furries, so he tries to kill her new boyfriend.",keirmeister,858,https://reddit.com/r/ExplainAFilmPlotBadly/comments/e2p2pv/the_towns_most_eligible_bachelor_gets_turned_down/
"A gang beats up a man of colour for trying to improve everyone’s lives",R3tr0M3m3s,819,https://reddit.com/r/ExplainAFilmPlotBadly/comments/f8w266/a_gang_beats_up_a_man_of_colour_for_trying_to/
"Popular jock has anger issues, drops out from school, marries his high school girlfriend and becomes a cop",user7526,823,https://reddit.com/r/ExplainAFilmPlotBadly/comments/hsvcgb/popular_jock_has_anger_issues_drops_out_from/
"Man finally gets head from his wife while a black guy watches",[deleted],808,https://reddit.com/r/ExplainAFilmPlotBadly/comments/eqzmzw/man_finally_gets_head_from_his_wife_while_a_black/
".dlrow eht fo dne eht tneverp ot smia noitarepo terceS",CheesyObserver,806,https://reddit.com/r/ExplainAFilmPlotBadly/comments/iffc3w/dlrow_eht_fo_dne_eht_tneverp_ot_smia_noitarepo/
"There's a vehicle that has to 'speed' around a city, keeping its 'speed' over fifty, and if its 'speed' drops, it will explode. I think it was called 'The Vehicle That Couldn't Slow Down?'",mercutio48,801,https://reddit.com/r/ExplainAFilmPlotBadly/comments/1k92uoq/theres_a_vehicle_that_has_to_speed_around_a_city/
"12 year old kid breaks into kids homes after the parents leave then proceeds to give the kids “magic dust” that makes the go high as a kite, then he kidnaps them and brings them to a place where they will never grow up filled with murders and racist furries.",jepedo-just-jepedo,799,https://reddit.com/r/ExplainAFilmPlotBadly/comments/e1hb4i/12_year_old_kid_breaks_into_kids_homes_after_the/
"Everyone tries to keep a single dad from snapping.",RedHood000,798,https://reddit.com/r/ExplainAFilmPlotBadly/comments/9do6f9/everyone_tries_to_keep_a_single_dad_from_snapping/
"4 New Yorkers get stranded on a tropical island and one of them tries to turn it into a donner party when he gets high and has a really bad case of the munchies",LordWeaselton,788,https://reddit.com/r/ExplainAFilmPlotBadly/comments/eli16h/4_new_yorkers_get_stranded_on_a_tropical_island/
"Middle-Aged Environmentalist Tries to Collect Colorful Rocks but is Challenged by Men with Facial Hair",ForkMinus1,766,https://reddit.com/r/ExplainAFilmPlotBadly/comments/8g518k/middleaged_environmentalist_tries_to_collect/
"Man is dying, so he becomes an alcoholic and spirals until he saves himself. Another guy wants a bird.",StormfistMusic,759,https://reddit.com/r/ExplainAFilmPlotBadly/comments/du81mx/man_is_dying_so_he_becomes_an_alcoholic_and/
"He skips his eye exam, destroys the office, delivers a baby, receives a royal last will and testament, smashes up a jewelry store, and finally kills a dude over his snack. Bot bad for a first day on the job.",BaconConnoisseur,752,https://reddit.com/r/ExplainAFilmPlotBadly/comments/duwgw6/he_skips_his_eye_exam_destroys_the_office/
"32yo teenager supports elderly parental figure by selling photos of self in skin-tight clothing.",MightGetFiredIDK,755,https://reddit.com/r/ExplainAFilmPlotBadly/comments/g627ib/32yo_teenager_supports_elderly_parental_figure_by/
"After being released from prison, man laments lost time while immediately seeking revenge. Also, there’s a… frog?",TheDorkKnight53,750,https://reddit.com/r/ExplainAFilmPlotBadly/comments/1ejalko/after_being_released_from_prison_man_laments_lost/
"Take your son to work day ends with the dad killing his boss",acoyne1,743,https://reddit.com/r/ExplainAFilmPlotBadly/comments/e88t4x/take_your_son_to_work_day_ends_with_the_dad/
"Religious cult uses a child soldier to blow up a corporation's headquarters to so they can restore the monarchy",SploonTheDude,740,https://reddit.com/r/ExplainAFilmPlotBadly/comments/dwfsk4/religious_cult_uses_a_child_soldier_to_blow_up_a/
"Man isn't qualified for the job, but he needs it nevertheless, so he seals a pact with a strange creature to grant him the power to get through the challenges ahead.",[deleted],739,https://reddit.com/r/ExplainAFilmPlotBadly/comments/jap7a9/man_isnt_qualified_for_the_job_but_he_needs_it/
"A father wants his reluctant son to help in the family business. Eventually the son gives his dad a hand.",[deleted],735,https://reddit.com/r/ExplainAFilmPlotBadly/comments/j8zw72/a_father_wants_his_reluctant_son_to_help_in_the/
"Put that thing back where it came from or so help me.",Nova_Saibrock,721,https://reddit.com/r/ExplainAFilmPlotBadly/comments/duj54j/put_that_thing_back_where_it_came_from_or_so_help/
"The town thinks the old-fashioned sheriff murdered the mysterious modern stranger. The sheriff and the newcomer have to put aside their differences when they’re kidnapped by a murderous sociopath.",why___not___zoidberg,721,https://reddit.com/r/ExplainAFilmPlotBadly/comments/e5r6eb/the_town_thinks_the_oldfashioned_sheriff_murdered/
"Everyone tries the ice bucket challenge",Clever_Username06,715,https://reddit.com/r/ExplainAFilmPlotBadly/comments/e4jx8l/everyone_tries_the_ice_bucket_challenge/
"Two wizards get into a fight. One wizard decides to get high, and leaves the other one to light up alone.",TheLovingNightmare,712,https://reddit.com/r/ExplainAFilmPlotBadly/comments/erquue/two_wizards_get_into_a_fight_one_wizard_decides/
"Man has his inner voice surgically removed, gives it to a 60 year old obsessed with a little girl",Eran-of-Arcadia,710,https://reddit.com/r/ExplainAFilmPlotBadly/comments/gxrati/man_has_his_inner_voice_surgically_removed_gives/
"Guy has house party, robs a crackhead, breaks into a massive vault, and fights a bunch of rival gangs.",jsilvy,706,https://reddit.com/r/ExplainAFilmPlotBadly/comments/f4san2/guy_has_house_party_robs_a_crackhead_breaks_into/
"After his big sister breaks his favorite toy, an orphaned boy runs away to stay with a friend. After a few weeks, he returns to get revenge and with his friend’s help he kills his sister’s dog and burns down their home with her still inside.",Thegingerkid01,696,https://reddit.com/r/ExplainAFilmPlotBadly/comments/8kqbs4/after_his_big_sister_breaks_his_favorite_toy_an/
"Guy is trained in the use of fingers by older woman",[deleted],687,https://reddit.com/r/ExplainAFilmPlotBadly/comments/cwmxb2/guy_is_trained_in_the_use_of_fingers_by_older/
"It's like if that Kanye song was about babies.",Quirky-Reputation-89,683,https://reddit.com/r/ExplainAFilmPlotBadly/comments/1iork1k/its_like_if_that_kanye_song_was_about_babies/
"Two mothers, black and white, fight over the black's reproductive rights.",IntelligentPredator,682,https://reddit.com/r/ExplainAFilmPlotBadly/comments/dy3wyi/two_mothers_black_and_white_fight_over_the_blacks/
"Child gets abused for the first 10 years of his life then gets kidnapped by a big bearded man on his 11th birthday",[deleted],684,https://reddit.com/r/ExplainAFilmPlotBadly/comments/9eolj4/child_gets_abused_for_the_first_10_years_of_his/
"A teenage girl marries a foot fetishist to escape her abusive family.",SleepingIsUnderrated,673,https://reddit.com/r/ExplainAFilmPlotBadly/comments/iv3gfr/a_teenage_girl_marries_a_foot_fetishist_to_escape/
"2 guys 1 cup",dangergypsy,659,https://reddit.com/r/ExplainAFilmPlotBadly/comments/iis9mb/2_guys_1_cup/
"People sleeping on an international flight. Then they get off the plane, uneventfully.",Patient-Principle,654,https://reddit.com/r/ExplainAFilmPlotBadly/comments/ey3hy3/people_sleeping_on_an_international_flight_then/
"A kid announces and sings to the whole world that he can't wait for his father to be dead so he can replace him as the leader of their community",jrfnavarro,652,https://reddit.com/r/ExplainAFilmPlotBadly/comments/jr65ws/a_kid_announces_and_sings_to_the_whole_world_that/
"My dad is dead.. wait no he's not. Yes he is. No he's not. Hol up my friend is my dad.",garbonzobean22,649,https://reddit.com/r/ExplainAFilmPlotBadly/comments/j5hyfa/my_dad_is_dead_wait_no_hes_not_yes_he_is_no_hes/
"Orphan likes to dress up at night, tie and punish naughty boys",MrCastielPT,653,https://reddit.com/r/ExplainAFilmPlotBadly/comments/i90xmf/orphan_likes_to_dress_up_at_night_tie_and_punish/
"A boy drugs his grandmother and enlists an african tribe to tie him up and squeeze all of the fluid out of him so that he can pay off a debt to a construction development company that wants to evict him.",Aggressive_Muffin,648,https://reddit.com/r/ExplainAFilmPlotBadly/comments/eu2g0q/a_boy_drugs_his_grandmother_and_enlists_an/
"Grandpa wants to make a fortune out of mosquitos",PARhymE,645,https://reddit.com/r/ExplainAFilmPlotBadly/comments/dth4rg/grandpa_wants_to_make_a_fortune_out_of_mosquitos/
"Declared public menace kidnaps child and murders elderly celebrity just to fulfill a fantasy involving a dead woman",ricarleite1,647,https://reddit.com/r/ExplainAFilmPlotBadly/comments/d6uflo/declared_public_menace_kidnaps_child_and_murders/
"The whole family has to move because of dad’s job. Everything goes horribly wrong, dad dies and teen son ends up lost and addicted to drugs. But he literally meets the girl of his dreams. ",[deleted],640,https://reddit.com/r/ExplainAFilmPlotBadly/comments/1hf88vp/the_whole_family_has_to_move_because_of_dads_job/
"Lonely guy kills a family of european immigrants because he saw one of them smash his favourite bi*ch",Triktastic,630,https://reddit.com/r/ExplainAFilmPlotBadly/comments/f1s9hl/lonely_guy_kills_a_family_of_european_immigrants/
"Autistic man raised by Christian-adjacent cult falls in love with a woman too attractive to be working in a dept. store. ",DueSupport2703,628,https://reddit.com/r/ExplainAFilmPlotBadly/comments/1hm8whh/autistic_man_raised_by_christianadjacent_cult/
"Some nerd kisses his sister and fights his dad.",throwawaybyebye17,625,https://reddit.com/r/ExplainAFilmPlotBadly/comments/9edboo/some_nerd_kisses_his_sister_and_fights_his_dad/
"Girl gets engaged to the first guy she meets but then falls for another guy she meets later that day.",TisMeBeinMe,621,https://reddit.com/r/ExplainAFilmPlotBadly/comments/hunkgk/girl_gets_engaged_to_the_first_guy_she_meets_but/
"European sports star asks out pretty but nerdy 14 year old",TheQcumber69,628,https://reddit.com/r/ExplainAFilmPlotBadly/comments/egr722/european_sports_star_asks_out_pretty_but_nerdy_14/
"[Series] Two boys build stuff while their pet bullies a pharmacist",AnthonyTheIntrovert,626,https://reddit.com/r/ExplainAFilmPlotBadly/comments/hdw4t3/series_two_boys_build_stuff_while_their_pet/
"Girl uses 100% of her brain to get adopted by a better parent.",Eyes_of_The_Lord,618,https://reddit.com/r/ExplainAFilmPlotBadly/comments/heggkq/girl_uses_100_of_her_brain_to_get_adopted_by_a/
"A man is able to see the future but everybody ridicules him instead of helping, resulting in the death of his wife",ScheidNation21,619,https://reddit.com/r/ExplainAFilmPlotBadly/comments/gm8qmr/a_man_is_able_to_see_the_future_but_everybody/
"Jesus is a furry and decides to give power to a bunch of kids.",jsilvy,616,https://reddit.com/r/ExplainAFilmPlotBadly/comments/fq0pxd/jesus_is_a_furry_and_decides_to_give_power_to_a/
"01001101 01101111 01100001 01101110 01100001 00100000 01100010 01110101 01110100 00100000 01001101 01100101 01111000 01101001 01100011 01100001 01101110 00100000",thogolicious,608,https://reddit.com/r/ExplainAFilmPlotBadly/comments/f9t6y3/01001101_01101111_01100001_01101110_01100001/
"A ship tragically sinks in this one. An upper class girl meets a lower class boy on a maiden journey. She’s engaged to a rich jerk; he’s traveling with his easygoing buddy. When things go wrong, they’re exposed to frigid conditions. She survives—her heart will go on.",HeftyButton,609,https://reddit.com/r/ExplainAFilmPlotBadly/comments/1lmv3cb/a_ship_tragically_sinks_in_this_one_an_upper/
"A creepy old man finally achieves his goal of being able to touch a 14 year old boy",Goodzon,610,https://reddit.com/r/ExplainAFilmPlotBadly/comments/ipwye1/a_creepy_old_man_finally_achieves_his_goal_of/
"A monarch illegally breaks into another nation, kidnaps their leader and steals their identity, wreaks havoc on their country and survives an assassination attempt, and in the end learns the lesson that you should never change and you should only stay with your own kind.",[deleted],602,https://reddit.com/r/ExplainAFilmPlotBadly/comments/j49k3t/a_monarch_illegally_breaks_into_another_nation/
"A group of deformed teenagers battle a gang of body parts led by a piece of office equipment.",boy_yeets_world,602,https://reddit.com/r/ExplainAFilmPlotBadly/comments/fnl9ze/a_group_of_deformed_teenagers_battle_a_gang_of/
"This movie is one part Tom and Jerry, one part Harry Potter, and one part foot fetish",[deleted],600,https://reddit.com/r/ExplainAFilmPlotBadly/comments/f0sldh/this_movie_is_one_part_tom_and_jerry_one_part/
"The president of China searches for a friend's missing body part while slowly starving to death",Omboreas,596,https://reddit.com/r/ExplainAFilmPlotBadly/comments/ja7kwg/the_president_of_china_searches_for_a_friends/
"How to Get Good at Explaining Films Badly: A Guide",Rephath,601,https://reddit.com/r/ExplainAFilmPlotBadly/comments/1f171l8/how_to_get_good_at_explaining_films_badly_a_guide/
"A survival of the fittest contest inside a sweatshop, winner gets the sweatshop",ziv_hamagniv,596,https://reddit.com/r/ExplainAFilmPlotBadly/comments/j1wome/a_survival_of_the_fittest_contest_inside_a/
"Man can make his penis bigger whenever he wants",justjay07,597,https://reddit.com/r/ExplainAFilmPlotBadly/comments/j9datv/man_can_make_his_penis_bigger_whenever_he_wants/
"Man has everything but loses his wife. Travels to the future only to be murdered by her.",Jesus_for_profit,587,https://reddit.com/r/ExplainAFilmPlotBadly/comments/imqtkg/man_has_everything_but_loses_his_wife_travels_to/
"It takes 63 minutes for the movie’s title to actually start",Blastspark01,588,https://reddit.com/r/ExplainAFilmPlotBadly/comments/fc2ljr/it_takes_63_minutes_for_the_movies_title_to/
"So it turns out there's this world with witches and wizards and magic and stuff right along side our world. Main character grew up without knowing they were a part of it. Trains to use magic and fly on fancy modern looking brooms. Eventually defeats the bad dude with a creepy grey-skinned face.",Anon-Ymous929,585,https://reddit.com/r/ExplainAFilmPlotBadly/comments/jgpiqv/so_it_turns_out_theres_this_world_with_witches/
"So there's this guy, and he just doesn't like babies, and his girlfriend really wants to change his mind so they take a vacation to a tropical island where she makes him spend the day with these two kids they met that took a liking to him.",lallapalalable,585,https://reddit.com/r/ExplainAFilmPlotBadly/comments/is2uhn/so_theres_this_guy_and_he_just_doesnt_like_babies/
"[Meta] Your post in ExplainAFilmPlotBadly should actually be explaining the *plot*.",SciFiXhi,585,https://reddit.com/r/ExplainAFilmPlotBadly/comments/1kgy6o8/meta_your_post_in_explainafilmplotbadly_should/
"[META] Stop erasing your guesses",Pope_Cerebus,577,https://reddit.com/r/ExplainAFilmPlotBadly/comments/ioig96/meta_stop_erasing_your_guesses/
"Coloured man is segregated from society until he takes down a ruthless dictator and saves the girl",R3tr0M3m3s,576,https://reddit.com/r/ExplainAFilmPlotBadly/comments/h0y0q9/coloured_man_is_segregated_from_society_until_he/
"Socially isolating children creates adults who make poor decisions",buzz1627,572,https://reddit.com/r/ExplainAFilmPlotBadly/comments/h7pkev/socially_isolating_children_creates_adults_who/
"A professional athlete develops Stockholm syndrome after the residents of a small town holds him against his will",doctormisterio19,567,https://reddit.com/r/ExplainAFilmPlotBadly/comments/a4mrt4/a_professional_athlete_develops_stockholm/
"[META] The Batman Rule.",timeshaper,569,https://reddit.com/r/ExplainAFilmPlotBadly/comments/lg6g0j/meta_the_batman_rule/
"A young mother dies of AIDS after encouraging a friend's running career",tasteslikechimp,564,https://reddit.com/r/ExplainAFilmPlotBadly/comments/dsjsk3/a_young_mother_dies_of_aids_after_encouraging_a/
"Old man kidnaps Asian kid, kills celebrity.",AranaesReddit,559,https://reddit.com/r/ExplainAFilmPlotBadly/comments/jmrs0h/old_man_kidnaps_asian_kid_kills_celebrity/
"Man gets his lifetime crush killed, spends rest of his life plotting to save her son’s life",cheesybread336,560,https://reddit.com/r/ExplainAFilmPlotBadly/comments/ih9sgh/man_gets_his_lifetime_crush_killed_spends_rest_of/
"Two naked factory workers run from the authorities after kidnapping a kid.",RikCooper,561,https://reddit.com/r/ExplainAFilmPlotBadly/comments/g258f6/two_naked_factory_workers_run_from_the/
"Old man mourning the loss of his wife abducts a small asian boy",SimplyZea,558,https://reddit.com/r/ExplainAFilmPlotBadly/comments/hjyjwp/old_man_mourning_the_loss_of_his_wife_abducts_a/
"Boy gets psychologically tortured until he learns to beat something with sticks correctly",mydogs7thnipple,560,https://reddit.com/r/ExplainAFilmPlotBadly/comments/dtuyl5/boy_gets_psychologically_tortured_until_he_learns/
"A gang comes together to bully the little brother of one of them",Darhty,560,https://reddit.com/r/ExplainAFilmPlotBadly/comments/hx2pfj/a_gang_comes_together_to_bully_the_little_brother/
"Man denied Promotion; Massaceres children.",Xx_k4ng4r00_xX,557,https://reddit.com/r/ExplainAFilmPlotBadly/comments/9jgwy6/man_denied_promotion_massaceres_children/
"A guy’s wife tries going topless. It causes problems for them.",HeftyButton,557,https://reddit.com/r/ExplainAFilmPlotBadly/comments/1jquilh/a_guys_wife_tries_going_topless_it_causes/
"A man with a drinking problem gets a chance to fly a plane again. He crashes, likely killing thousands, but his kids are still proud of him.",C4dfael,550,https://reddit.com/r/ExplainAFilmPlotBadly/comments/1i62ygz/a_man_with_a_drinking_problem_gets_a_chance_to/
"A hard working prodigy is denied a legendary promotion, punished for displaying his disapproval, only to have that position given to a complete greenhorn",[deleted],546,https://reddit.com/r/ExplainAFilmPlotBadly/comments/gye4d8/a_hard_working_prodigy_is_denied_a_legendary/
"A twist! And then lesbian sex. And then another twist! And then lesbian sex. And then another twist! And end with some lesbian text.",[deleted],547,https://reddit.com/r/ExplainAFilmPlotBadly/comments/ejx0eo/a_twist_and_then_lesbian_sex_and_then_another/
