title,author,upvotes,permalink
"A metal man, a guy who's over a century old, and a person who's an alien that looks almost exactly like a human hey into time-traveling hijinks as they try to stop a purple dude with a weird chin. The old guy winds up fighting a version of himself from a different timeline at one point.",[deleted],366,https://reddit.com/r/ExplainAFilmPlotBadly/comments/ewxl2e/a_metal_man_a_guy_whos_over_a_century_old_and_a/
"Lifejacket guy avoids incest and saves the prom.",CranberryJuiceGuy,362,https://reddit.com/r/ExplainAFilmPlotBadly/comments/i9bepj/lifejacket_guy_avoids_incest_and_saves_the_prom/
"Girl with a gift enters a competition against her mother's will and ends up sharing 1st place with an Asian kid.",WinterMonday,363,https://reddit.com/r/ExplainAFilmPlotBadly/comments/eyyay1/girl_with_a_gift_enters_a_competition_against_her/
"Guy enslaved for taking food. Takes up a fake identity and adopts a kid.",JaketendoYT,368,https://reddit.com/r/ExplainAFilmPlotBadly/comments/jptdwb/guy_enslaved_for_taking_food_takes_up_a_fake/
"Alcoholic, employed by his mother, has sex with his coworkers, (series",maxpower52,361,https://reddit.com/r/ExplainAFilmPlotBadly/comments/igvcy5/alcoholic_employed_by_his_mother_has_sex_with_his/
"Crazy war veteran husband murders children in hopes of keeping him and his wife together forever",LavaringX,367,https://reddit.com/r/ExplainAFilmPlotBadly/comments/gvjkw7/crazy_war_veteran_husband_murders_children_in/
"A former metal worker, a dishonorably discharged veteran and Keith Richards squabble over a piece of furniture that contains a pump.",overmind87,365,https://reddit.com/r/ExplainAFilmPlotBadly/comments/g96z7w/a_former_metal_worker_a_dishonorably_discharged/
"A construction worker, a goth chick, and a wizard walk into a bar.",[deleted],362,https://reddit.com/r/ExplainAFilmPlotBadly/comments/c7g7ku/a_construction_worker_a_goth_chick_and_a_wizard/
"Man bravely comes out as openly gay in the 50's. At the end of the movie he reveals he's not actually gay.",baxterhugger,361,https://reddit.com/r/ExplainAFilmPlotBadly/comments/1kp7b2m/man_bravely_comes_out_as_openly_gay_in_the_50s_at/
"Emotionally empty 100 year old grandpa gets stalked by a singer to save the world",RiceOfDuckness,360,https://reddit.com/r/ExplainAFilmPlotBadly/comments/kjevj6/emotionally_empty_100_year_old_grandpa_gets/
"Bad boy falls in love with a good girl and gets arrested. Tries to escape but is released instead and ends up challenging her ex boyfriend.",bigmommacasper,360,https://reddit.com/r/ExplainAFilmPlotBadly/comments/ii4vi0/bad_boy_falls_in_love_with_a_good_girl_and_gets/
"A young couple flees the country after learning that their hotel doesn't serve the food they want",lobstahcodah,364,https://reddit.com/r/ExplainAFilmPlotBadly/comments/jwqzm1/a_young_couple_flees_the_country_after_learning/
"Grandma comes to visit a family but she's actually a murderer and makes all their problems go away",jD91mZM2,364,https://reddit.com/r/ExplainAFilmPlotBadly/comments/fjsm9a/grandma_comes_to_visit_a_family_but_shes_actually/
"A man slaughters several people, bullies a disabled man, betrays his own family, commits identity theft, and ultimately abandons his lover only a few hours after convincing her that she can trust him.",enehar,363,https://reddit.com/r/ExplainAFilmPlotBadly/comments/ky1t9n/a_man_slaughters_several_people_bullies_a/
"Property development on a continental scale thwarted by time travel.",FalconLord92,364,https://reddit.com/r/ExplainAFilmPlotBadly/comments/id912m/property_development_on_a_continental_scale/
"Rich man goes ballistic on terrorists who kidnapped him, then going onto fire his business partner.",CptGamer-FifthReddit,364,https://reddit.com/r/ExplainAFilmPlotBadly/comments/fm1zhz/rich_man_goes_ballistic_on_terrorists_who/
"Batman is dumb and Jason Bourn is smart.",EL_Golden,364,https://reddit.com/r/ExplainAFilmPlotBadly/comments/juecef/batman_is_dumb_and_jason_bourn_is_smart/
"Kid is a brat",resurrectionking,363,https://reddit.com/r/ExplainAFilmPlotBadly/comments/i4rqvm/kid_is_a_brat/
"Aliens decide to try human flavored cotton candy",TheLostBattalion1918,361,https://reddit.com/r/ExplainAFilmPlotBadly/comments/euy918/aliens_decide_to_try_human_flavored_cotton_candy/
"Man becomes a terrorist because he can’t get a promotion",ardywestprov,363,https://reddit.com/r/ExplainAFilmPlotBadly/comments/c6ssmz/man_becomes_a_terrorist_because_he_cant_get_a/
"Underweight child forces a lizard to be an acrobat",[deleted],361,https://reddit.com/r/ExplainAFilmPlotBadly/comments/ls3zp4/underweight_child_forces_a_lizard_to_be_an_acrobat/
"What people in 1993 thought a person from 1996 would feel like if brought to the year 2032",lady_anchor,356,https://reddit.com/r/ExplainAFilmPlotBadly/comments/gnoumx/what_people_in_1993_thought_a_person_from_1996/
"After an initial misunderstanding pits them against each other, a reporter, his fast talking assistant, an extreme sports enthusiast, a wannabe actor, and a delivery girl team up to stop an evil plot that would heavily disrupt the region’s economy.",dontcallmewave,357,https://reddit.com/r/ExplainAFilmPlotBadly/comments/glpz7y/after_an_initial_misunderstanding_pits_them/
"small town cop and cgi rework beatup socially inept scientific genius",shadow_wulf82,353,https://reddit.com/r/ExplainAFilmPlotBadly/comments/hgsfbo/small_town_cop_and_cgi_rework_beatup_socially/
"Literally the first movie but in Thailand",Footballfan91,355,https://reddit.com/r/ExplainAFilmPlotBadly/comments/b7bktl/literally_the_first_movie_but_in_thailand/
"Godzilla's cousins showed up so we built some Gundams",bstillwell15,357,https://reddit.com/r/ExplainAFilmPlotBadly/comments/iygkno/godzillas_cousins_showed_up_so_we_built_some/
"A guy has a midlife crisis and begins making suits in his free time. He then proceeds to kill his less experienced competition.",young_fire,357,https://reddit.com/r/ExplainAFilmPlotBadly/comments/bd3bwo/a_guy_has_a_midlife_crisis_and_begins_making/
"A gay rights activists fights count dooku and gets imprisoned",lordrazumdar,354,https://reddit.com/r/ExplainAFilmPlotBadly/comments/i5qxi8/a_gay_rights_activists_fights_count_dooku_and/
"In this Christmas tale, a schoolteacher discovers herself, reconnects with her ex, travels to New Jersey and decides to get a puppy.",Jaleou,353,https://reddit.com/r/ExplainAFilmPlotBadly/comments/ei2jmd/in_this_christmas_tale_a_schoolteacher_discovers/
"Guy on hard drugs destroys everything.",Michurichu,355,https://reddit.com/r/ExplainAFilmPlotBadly/comments/gfoquw/guy_on_hard_drugs_destroys_everything/
"6 people end up dying because a sheltered Christian girl touched herself for the first time",Living-Mastodon,353,https://reddit.com/r/ExplainAFilmPlotBadly/comments/1j8xvs9/6_people_end_up_dying_because_a_sheltered/
"The hero isn't actually the hero, the villain dies unceremoniously, the two never meet, and the film ends with sex in front of the President",Neb810,353,https://reddit.com/r/ExplainAFilmPlotBadly/comments/1incbed/the_hero_isnt_actually_the_hero_the_villain_dies/
"Protagonist is a courageous and rebellious 16-year-old girl who is really good at archery and might appear to be on fire. But her name isn't Katniss.",PointyOintment,352,https://reddit.com/r/ExplainAFilmPlotBadly/comments/kq3kpx/protagonist_is_a_courageous_and_rebellious/
"[TV Series] A bunch of professional voice actors make a shitpost together",CallMeDelta,351,https://reddit.com/r/ExplainAFilmPlotBadly/comments/jlha69/tv_series_a_bunch_of_professional_voice_actors/
"Evil old man is incredibly good at social distancing.",acoyne1,352,https://reddit.com/r/ExplainAFilmPlotBadly/comments/gdj3ut/evil_old_man_is_incredibly_good_at_social/
"Mans adventure made difficult by people shouting the N-word.",AlduinIsAGeordie,355,https://reddit.com/r/ExplainAFilmPlotBadly/comments/n1q8u4/mans_adventure_made_difficult_by_people_shouting/
"Dissatisfied blue collar worker takes a vacation of a lifetime where he rediscovers his past, cheats on his wife and changes the future for the better.",SenileSexLine,353,https://reddit.com/r/ExplainAFilmPlotBadly/comments/l9eutd/dissatisfied_blue_collar_worker_takes_a_vacation/
"A middle-eastern dictator takes advantage of the war in north America to rule the world",arya11b76,349,https://reddit.com/r/ExplainAFilmPlotBadly/comments/hkfzq2/a_middleeastern_dictator_takes_advantage_of_the/
"Unemployed Dad loses expensive box. In the end, gets back the box and becomes employed. His kid loses his hero though.",TheArnoSypher,351,https://reddit.com/r/ExplainAFilmPlotBadly/comments/him6iy/unemployed_dad_loses_expensive_box_in_the_end/
"Paris Hilton's beauty tutorial on getting that perfect smooth skin.",BaconConnoisseur,350,https://reddit.com/r/ExplainAFilmPlotBadly/comments/fg0vvc/paris_hiltons_beauty_tutorial_on_getting_that/
"An old lady falls in love with an immature wizard and ends a war",voldemortsenemy,351,https://reddit.com/r/ExplainAFilmPlotBadly/comments/dnou9o/an_old_lady_falls_in_love_with_an_immature_wizard/
"A guys first day at work goes really bad. No one calls him by his name, his co-workers hate him and, and ultimately he's responsible for everything.",DasGier,352,https://reddit.com/r/ExplainAFilmPlotBadly/comments/mla87e/a_guys_first_day_at_work_goes_really_bad_no_one/
"Man performs open heart surgery on himself in a bat house.",gandalf1420,353,https://reddit.com/r/ExplainAFilmPlotBadly/comments/kikgsz/man_performs_open_heart_surgery_on_himself_in_a/
"ghost kills people, but it’s a ww2 allegory",slamporaaa,356,https://reddit.com/r/ExplainAFilmPlotBadly/comments/ieegn9/ghost_kills_people_but_its_a_ww2_allegory/
"Boy does a really shitty job at babysitting his little sister",TheBestoftheBubbs,351,https://reddit.com/r/ExplainAFilmPlotBadly/comments/gx9hj8/boy_does_a_really_shitty_job_at_babysitting_his/
"Kids have romance and are sexist to girls",PerryThePickle,353,https://reddit.com/r/ExplainAFilmPlotBadly/comments/fd1idl/kids_have_romance_and_are_sexist_to_girls/
"[META] Can we ban Finding Nemo posts?",[deleted],347,https://reddit.com/r/ExplainAFilmPlotBadly/comments/c6jki0/meta_can_we_ban_finding_nemo_posts/
"What the government thinks we want when we ask for “equality”",[deleted],351,https://reddit.com/r/ExplainAFilmPlotBadly/comments/ihmg1y/what_the_government_thinks_we_want_when_we_ask/
"A abused kid goes to a new school and kills a teacher.",Reyals15,354,https://reddit.com/r/ExplainAFilmPlotBadly/comments/al1mkf/a_abused_kid_goes_to_a_new_school_and_kills_a/
"Girl gets together with friends, goes on a cruise, and finds herself.",Jaleou,350,https://reddit.com/r/ExplainAFilmPlotBadly/comments/fo51yj/girl_gets_together_with_friends_goes_on_a_cruise/
"Teacher does nothing useful while fascists burn themselves to deatb",ricarleite1,351,https://reddit.com/r/ExplainAFilmPlotBadly/comments/d4ryqr/teacher_does_nothing_useful_while_fascists_burn/
"Being a lawyer and a dad is difficult enough without having your son cast a spell on you.",Burgerman117,348,https://reddit.com/r/ExplainAFilmPlotBadly/comments/k5c3z8/being_a_lawyer_and_a_dad_is_difficult_enough/
"💰🐶",MissBarker93,346,https://reddit.com/r/ExplainAFilmPlotBadly/comments/jjdri5/_/
"Fat restaurant worker forced to stop an escaped convict because everyone thought it was his job",ActSci_Journey,346,https://reddit.com/r/ExplainAFilmPlotBadly/comments/1iwi7rv/fat_restaurant_worker_forced_to_stop_an_escaped/
"A talented rat exerts control when he's not supposed to. He lets out a secret no one expected him to reveal. There's singing.",Fresh_Passion1184,347,https://reddit.com/r/ExplainAFilmPlotBadly/comments/1i1hrir/a_talented_rat_exerts_control_when_hes_not/
"Immortals try to die by bleeding one of their owns kid",nalk201,348,https://reddit.com/r/ExplainAFilmPlotBadly/comments/k30n74/immortals_try_to_die_by_bleeding_one_of_their/
"Trainee monk jerks off over older politician while his mate hangs out with some well-trained doppelgangers.",acoyne1,349,https://reddit.com/r/ExplainAFilmPlotBadly/comments/co1iz4/trainee_monk_jerks_off_over_older_politician/
"Protagonist escapes his incest-ridden community and sues everyone else.",AceiteDeOlivas,350,https://reddit.com/r/ExplainAFilmPlotBadly/comments/civrby/protagonist_escapes_his_incestridden_community/
"Rich guy beats up a WWII veteran and steals his belongings",Goombarang,351,https://reddit.com/r/ExplainAFilmPlotBadly/comments/bvfbh7/rich_guy_beats_up_a_wwii_veteran_and_steals_his/
"Two brothers. In a van. And then a meteor hit.",I_am_Groot69,347,https://reddit.com/r/ExplainAFilmPlotBadly/comments/b0w8kw/two_brothers_in_a_van_and_then_a_meteor_hit/
"In this movie, big stuff happens Under the Sea. Singing, dancing and classic tunes UNDER THE SEA! The protagonist is a fish out of water and yearns to go back to their world. When it's time to Kiss the Girl, they get foiled! Boy, does this protagonist have daddy issues and is also famously little.",TomahawkA5,343,https://reddit.com/r/ExplainAFilmPlotBadly/comments/1kia212/in_this_movie_big_stuff_happens_under_the_sea/
"A king wants to marry off his son to a girl who is a different species",jennoefur,351,https://reddit.com/r/ExplainAFilmPlotBadly/comments/jlzlxz/a_king_wants_to_marry_off_his_son_to_a_girl_who/
"A cop extorts a career criminal to depose an innocent (yes I know) politician",Jesus_for_profit,347,https://reddit.com/r/ExplainAFilmPlotBadly/comments/ji3jgf/a_cop_extorts_a_career_criminal_to_depose_an/
"Man thrashes the place just to find a bird",nmatsachogi,348,https://reddit.com/r/ExplainAFilmPlotBadly/comments/i0qtbh/man_thrashes_the_place_just_to_find_a_bird/
"Horny old man sees son’s crush dance, she gets on the pole for him, things get hot.",[deleted],346,https://reddit.com/r/ExplainAFilmPlotBadly/comments/ddcdy3/horny_old_man_sees_sons_crush_dance_she_gets_on/
"Most people can not-see this boy’s imaginary friend",[deleted],347,https://reddit.com/r/ExplainAFilmPlotBadly/comments/mmta9g/most_people_can_notsee_this_boys_imaginary_friend/
"Grown man goes on a rampage because little girl has another friend",Iamprettyterrible,344,https://reddit.com/r/ExplainAFilmPlotBadly/comments/gpk661/grown_man_goes_on_a_rampage_because_little_girl/
"Grumpy person has a weird dream.",Almym,345,https://reddit.com/r/ExplainAFilmPlotBadly/comments/e7w1xg/grumpy_person_has_a_weird_dream/
"Crazy girl electrocute herself and thinks she's killing people",lilymonroe1,348,https://reddit.com/r/ExplainAFilmPlotBadly/comments/kcf8ev/crazy_girl_electrocute_herself_and_thinks_shes/
"Genius weapons creator sees the damage caused by his guns in the wrong hands, resolves to create a suit of power armor to destroy those weapons.",Jiffletta,346,https://reddit.com/r/ExplainAFilmPlotBadly/comments/mboesg/genius_weapons_creator_sees_the_damage_caused_by/
"[META] Movies Too Cool For School (So Don't Use Them) + No Spoiling New Movies",timeshaper,340,https://reddit.com/r/ExplainAFilmPlotBadly/comments/kop3eq/meta_movies_too_cool_for_school_so_dont_use_them/
"Inconsiderate prick gets his friends trapped in another world and they switch genders.",420ThotFuKr69,342,https://reddit.com/r/ExplainAFilmPlotBadly/comments/hj918c/inconsiderate_prick_gets_his_friends_trapped_in/
"A horny boy, A one man army, and a bunch of bugs",[deleted],342,https://reddit.com/r/ExplainAFilmPlotBadly/comments/gyvgr6/a_horny_boy_a_one_man_army_and_a_bunch_of_bugs/
"A family in a vehicle don’t get money",Mousssey666,340,https://reddit.com/r/ExplainAFilmPlotBadly/comments/fklmwg/a_family_in_a_vehicle_dont_get_money/
"A girl and her dog kill a woman, loot her body, then go off on a journey to kill again.",relddir123,342,https://reddit.com/r/ExplainAFilmPlotBadly/comments/bbbt3r/a_girl_and_her_dog_kill_a_woman_loot_her_body/
"Wolverine blames Batman for his wife's death. Half of Batman is in love with Black Widow.",Master_Freeze,338,https://reddit.com/r/ExplainAFilmPlotBadly/comments/kgyvy3/wolverine_blames_batman_for_his_wifes_death_half/
"In a journey of self discovery a young man blows up a leopard.",Sellum,342,https://reddit.com/r/ExplainAFilmPlotBadly/comments/k98v86/in_a_journey_of_self_discovery_a_young_man_blows/
"American woman discovers that Christmas happens in summer for some people",Lord_Derpington_,343,https://reddit.com/r/ExplainAFilmPlotBadly/comments/jv3vkm/american_woman_discovers_that_christmas_happens/
"High school student is worried about failing his classes so he starts a prostitution ring and goes swimming.",kermitsadeadbitch,343,https://reddit.com/r/ExplainAFilmPlotBadly/comments/gjkvmu/high_school_student_is_worried_about_failing_his/
"[TV SHOW] psychotic man forces children to do dangerous tasks and decide who to deport.",[deleted],345,https://reddit.com/r/ExplainAFilmPlotBadly/comments/g2j3z1/tv_show_psychotic_man_forces_children_to_do/
"A PG-rated cartoon, that follows a gang of terrorists as they murder several innocent people to achieve their political ends.",KeiranEnne,343,https://reddit.com/r/ExplainAFilmPlotBadly/comments/mhzre6/a_pgrated_cartoon_that_follows_a_gang_of/
"Happy Cakeday, r/ExplainAFilmPlotBadly! Today you're 5",AutoModerator,337,https://reddit.com/r/ExplainAFilmPlotBadly/comments/kdqpl6/happy_cakeday_rexplainafilmplotbadly_today_youre_5/
"[Movie]Suicidal man wants a sadist to kill him",Rezero1234,342,https://reddit.com/r/ExplainAFilmPlotBadly/comments/jk7p63/moviesuicidal_man_wants_a_sadist_to_kill_him/
"He’s a bad guy, make his mama sad type, make a girl he likes mad type, might kill his dad type",[deleted],337,https://reddit.com/r/ExplainAFilmPlotBadly/comments/lhayr8/hes_a_bad_guy_make_his_mama_sad_type_make_a_girl/
"guy lies so he can have sex with a rich girl",Litandsexysidious,340,https://reddit.com/r/ExplainAFilmPlotBadly/comments/k7o2ps/guy_lies_so_he_can_have_sex_with_a_rich_girl/
"A lazy old man exploits his grandson and tries to get him to cheat a business owner after almost getting him killed",Thatguy755,335,https://reddit.com/r/ExplainAFilmPlotBadly/comments/lp1jj0/a_lazy_old_man_exploits_his_grandson_and_tries_to/
"Woman strips in front of man she met 2 days ago",Jonathan-Yao,343,https://reddit.com/r/ExplainAFilmPlotBadly/comments/k1utpx/woman_strips_in_front_of_man_she_met_2_days_ago/
"Baba Yaga kidnaps an old woman, Stockholm syndrome ensues.",YrTRANsitiveProperty,336,https://reddit.com/r/ExplainAFilmPlotBadly/comments/jq6z6z/baba_yaga_kidnaps_an_old_woman_stockholm_syndrome/
"Dungeons and Dragons but DISNEY",TheOutcast06,338,https://reddit.com/r/ExplainAFilmPlotBadly/comments/gv5dgs/dungeons_and_dragons_but_disney/
"A literal potato horror movie.",Virzha,340,https://reddit.com/r/ExplainAFilmPlotBadly/comments/ennpt3/a_literal_potato_horror_movie/
"Some dude tries to streal someone's job. Ends up getting shot down by the military.",ScenicFlyer41,340,https://reddit.com/r/ExplainAFilmPlotBadly/comments/dmf8k0/some_dude_tries_to_streal_someones_job_ends_up/
"Man gets his wife love back by being himself. Repeatedly.",bernardo_tucci,340,https://reddit.com/r/ExplainAFilmPlotBadly/comments/l3z0m3/man_gets_his_wife_love_back_by_being_himself/
"We all have a friend that’s a total ass. This guy does, too.",happibara,335,https://reddit.com/r/ExplainAFilmPlotBadly/comments/k6fzda/we_all_have_a_friend_thats_a_total_ass_this_guy/
"Woman tries to kill herself with the help of a giant rock on the sky just to have a better career.",SpasticGoldenToys,342,https://reddit.com/r/ExplainAFilmPlotBadly/comments/jqg469/woman_tries_to_kill_herself_with_the_help_of_a/
"Man loses his job in a shoe factory, later gets job as a cop.",Kenz463,341,https://reddit.com/r/ExplainAFilmPlotBadly/comments/gt1hbl/man_loses_his_job_in_a_shoe_factory_later_gets/
"A man should consider using Google docs after animal attack",EsotericBS,333,https://reddit.com/r/ExplainAFilmPlotBadly/comments/fe595s/a_man_should_consider_using_google_docs_after/
"Two families cause total chaos",Doctor_726,339,https://reddit.com/r/ExplainAFilmPlotBadly/comments/eidxm1/two_families_cause_total_chaos/
"Dude with a seemingly promising future kills children and almost burns to death.",Zatknish007,338,https://reddit.com/r/ExplainAFilmPlotBadly/comments/daccly/dude_with_a_seemingly_promising_future_kills/
"Grumpy old man ticks off bucket list with the help of a reluctant youth.",veggrorlr39392,341,https://reddit.com/r/ExplainAFilmPlotBadly/comments/hrqk1p/grumpy_old_man_ticks_off_bucket_list_with_the/
"Man try to get a new toy after his brother broke his toy.",[deleted],337,https://reddit.com/r/ExplainAFilmPlotBadly/comments/hfih8a/man_try_to_get_a_new_toy_after_his_brother_broke/
"Guy stops the Nazis by moving a stick of gum",iBlewupthemoon,336,https://reddit.com/r/ExplainAFilmPlotBadly/comments/fzqtcz/guy_stops_the_nazis_by_moving_a_stick_of_gum/
"This guy looks handsome, he looks smart, he is a walking work of art",TheFantasticXman1,340,https://reddit.com/r/ExplainAFilmPlotBadly/comments/fute59/this_guy_looks_handsome_he_looks_smart_he_is_a/
"Teenage boy abandons his job and widowed mother to sail to a foreign country and harass a celebrity everyone thinks is dead",brainsaresick,340,https://reddit.com/r/ExplainAFilmPlotBadly/comments/dh8cjc/teenage_boy_abandons_his_job_and_widowed_mother/
"American man somehow manages to be present at many major events of the 20th century during his lifetime. Most of it is told in flashback.",DwightFryFaneditor,338,https://reddit.com/r/ExplainAFilmPlotBadly/comments/1kl9ed0/american_man_somehow_manages_to_be_present_at/
"An illegal immigrant tries to destroy a child’s family and force her into a nonconsensual marriage.",MattTheSmithers,339,https://reddit.com/r/ExplainAFilmPlotBadly/comments/n7oarm/an_illegal_immigrant_tries_to_destroy_a_childs/
"Do you hear the people sing? Cause I sure don't.",rattatatouille,341,https://reddit.com/r/ExplainAFilmPlotBadly/comments/kvref6/do_you_hear_the_people_sing_cause_i_sure_dont/
"An island is infested with bad guys who are actually good guys but made to look like bad guys by the actual bad guys who look like good guys.",Footballfan91,340,https://reddit.com/r/ExplainAFilmPlotBadly/comments/b3qjlx/an_island_is_infested_with_bad_guys_who_are/
"This movie is absolutely riddled with errors. Like, if you don’t want to see 90 minutes straight of errors, don’t see this movie. It also features a bear doing illicit drugs.",TomahawkA5,336,https://reddit.com/r/ExplainAFilmPlotBadly/comments/1jhsydi/this_movie_is_absolutely_riddled_with_errors_like/
"Cosplay enthusiast locks three girls in the basement for the worst game of gues who ever.",[deleted],339,https://reddit.com/r/ExplainAFilmPlotBadly/comments/kmr297/cosplay_enthusiast_locks_three_girls_in_the/
"marines kill rubber suit demons for an 1:30:00",GibusGod420,336,https://reddit.com/r/ExplainAFilmPlotBadly/comments/imcxyc/marines_kill_rubber_suit_demons_for_an_13000/
"A guy drives",ImJustPat,333,https://reddit.com/r/ExplainAFilmPlotBadly/comments/go5my3/a_guy_drives/
"A guy takes drugs from a stranger and starts trippin. By the end he sees the world for what it really is.",ImKindaWrong,339,https://reddit.com/r/ExplainAFilmPlotBadly/comments/d88s11/a_guy_takes_drugs_from_a_stranger_and_starts/
"A kid's new disabled pet causes his dad to disown him. After saving his dad and friends, the kid becomes disabled himself. ",[deleted],332,https://reddit.com/r/ExplainAFilmPlotBadly/comments/1hnms95/a_kids_new_disabled_pet_causes_his_dad_to_disown/
"Girl falls in love with, and becomes, an assassin.",alluringalcove,338,https://reddit.com/r/ExplainAFilmPlotBadly/comments/gwxnwt/girl_falls_in_love_with_and_becomes_an_assassin/
"[SARCASM] Purple man finds coloured pebbles, daughter and friends tries to stop him [SARCASM]",Kuningas_Arthur,339,https://reddit.com/r/ExplainAFilmPlotBadly/comments/b4gf1t/sarcasm_purple_man_finds_coloured_pebbles/
"A animal goes from its home and almost dies, then it finds a female and they become friends, they then find some killers and save lots of its species.",Perhaps_cow_meme,335,https://reddit.com/r/ExplainAFilmPlotBadly/comments/kochg3/a_animal_goes_from_its_home_and_almost_dies_then/
"An obese cook is suddenly forced to join the most elite fighting group in the world. During intense training he goes on a journey of personal transformation and in the end is convinced to beat the crap out of a cat",afromagic808,330,https://reddit.com/r/ExplainAFilmPlotBadly/comments/foczis/an_obese_cook_is_suddenly_forced_to_join_the_most/
"Evil magical midget gets stuck in a box and then gets let out by an idiot",Its_Me_87,327,https://reddit.com/r/ExplainAFilmPlotBadly/comments/gktao6/evil_magical_midget_gets_stuck_in_a_box_and_then/
"The Animated Adventures of Pete and Pete",MissBarker93,334,https://reddit.com/r/ExplainAFilmPlotBadly/comments/ffbnso/the_animated_adventures_of_pete_and_pete/
"Government agencies from two different countries have to rescue a man because he ran out of potatoes.",noelg1998,333,https://reddit.com/r/ExplainAFilmPlotBadly/comments/9fjxto/government_agencies_from_two_different_countries/
"Vegetarian orphan overcomes racial prejudice to make friends and lead them to paradise.",Kelekona,332,https://reddit.com/r/ExplainAFilmPlotBadly/comments/ktuonx/vegetarian_orphan_overcomes_racial_prejudice_to/
"Near death experience makes wannabe gangster go Super Saiyan.",rattatatouille,331,https://reddit.com/r/ExplainAFilmPlotBadly/comments/kqnlfg/near_death_experience_makes_wannabe_gangster_go/
"Quirky musician makes his crush's ex orgasm to death",GodEmperorPorkyMinch,328,https://reddit.com/r/ExplainAFilmPlotBadly/comments/jwbagi/quirky_musician_makes_his_crushs_ex_orgasm_to/
"cool circles can predict the future",raccoonthrowaway_,328,https://reddit.com/r/ExplainAFilmPlotBadly/comments/g0jwc7/cool_circles_can_predict_the_future/
"Park owner fucks up. Again.",whoopity_Poop,330,https://reddit.com/r/ExplainAFilmPlotBadly/comments/exnm5t/park_owner_fucks_up_again/
